,Name,Type,Genres,Description,img_link
0,100 dagen in je hoofd,Documentary,['Documentary'],What is it like to be mentally ill? In this six-part documentary Tim den Besten and Nicolaas Veul immerse themselves in the world of psychiatry.,"https://m.media-amazon.com/images/M/MV5BMWM0OGY0NDctNGU4ZS00MzJkLWJjNmEtY2VhNjczNzJiMzBhXkEyXkFqcGdeQXVyODkxMjQ0MjQ@._V1_QL75_UY281_CR12,0,190,281_.jpg"
1,100 dingen,Movie,"['Comedy', 'Drama']","Best friends Toni and Paul decide to relinquish all of their belongings for 100 days, taking back one item per day. During this challenge, the two realize that the only thing they cannot be ... Read all","https://m.media-amazon.com/images/M/MV5BMThkYzQwZjktYzE4ZC00NWI2LThkNzMtMDIzNDY0YzM0OTU1XkEyXkFqcGdeQXVyMzgwNTE2MDU@._V1_QL75_UY281_CR5,0,190,281_.jpg"
2,100 hindoe,Movie,"['Adventure', 'Comedy']","After living a long and colorful life, Allan Karlsson finds himself stuck in a nursing home. On his 100th birthday, he leaps out a window and begins an unexpected journey.","https://m.media-amazon.com/images/M/MV5BNDUyMzU5MTk5MF5BMl5BanBnXkFtZTgwNjcxNDQxNTE@._V1_QL75_UX190_CR0,0,190,281_.jpg"
3,10xbeter buitenleven,Series,"['Comedy', 'Family']",A New York City attorney and his wife attempt to live as genteel farmers in the bizarre community of Hooterville.,"https://m.media-amazon.com/images/M/MV5BMTczMTQ1ODg3N15BMl5BanBnXkFtZTcwMTQ2NTQ4NA@@._V1_QL75_UX190_CR0,2,190,281_.jpg"
4,13 in de oorlog marathon,Series,['War'],The story of a 13 year old boy in occupied holland during WWII,"https://m.media-amazon.com/images/M/MV5BMDEzNjQ3N2MtNjUyZi00NDNiLTgxOTYtNTQ5MzdiMGNjOTMyXkEyXkFqcGdeQXVyMzg1ODEwNQ@@._V1_QL75_UY281_CR4,0,190,281_.jpg"
5,24 uur met,Tv,['Reality-TV'],Dutch version of 24 Hours With... (2007) in which interviewer and interviewee spend 24 hours in 1 room together.,"https://m.media-amazon.com/images/M/MV5BZTY1ZDQ2ZjgtY2EwNC00ZTI4LWI5NzMtNTYxMzY1NjJjMzA3XkEyXkFqcGdeQXVyMTgwOTE5NDk@._V1_QL75_UY281_CR156,0,190,281_.jpg"
6,25 jaar foute vrienden,Documentary,"['Documentary', 'Biography', 'Crime']",Director Roy Dames captures twenty-five years of his four main characters: Herman is richer after an experience and an illusion poorer. Things go wrong with Jantje van Amsterdam. Red Jos kee... Read all,"https://m.media-amazon.com/images/M/MV5BZjMxMWQyOTEtNWE2Yy00YmNkLTkyMjMtMDU5MDUyZWU2ODU4XkEyXkFqcGdeQXVyNjk5NDcxODM@._V1_QL75_UY207_CR114,0,140,207_.jpg"
7,2doc kort,Movie,"['Drama', 'Music', 'Romance']",Film version of Jacqueline Susann's best-selling novel chronicling the rise and fall of three young women in show business.,"https://m.media-amazon.com/images/M/MV5BOTBiZTg4ODgtYzk0MC00YjA5LTgyNGUtMWYzNGQzYjBlNmY0XkEyXkFqcGdeQXVyMTQxNzMzNDI@._V1_QL75_UY281_CR1,0,190,281_.jpg"
8,3 op reis compilaties,Tv,"['Adventure', 'Reality-TV']",A traveling program from the Netherlands.,"https://m.media-amazon.com/images/M/MV5BZjI0YTJiMzUtZWVkMC00YTA5LTg4YmUtOWFmNmQ1ZjM0MWEyXkEyXkFqcGdeQXVyMTgwOTE5NDk@._V1_QL75_UY281_CR4,0,190,281_.jpg"
9,3 op reis specials,Tv,"['Adventure', 'Reality-TV']",A traveling program from the Netherlands.,"https://m.media-amazon.com/images/M/MV5BZjI0YTJiMzUtZWVkMC00YTA5LTg4YmUtOWFmNmQ1ZjM0MWEyXkEyXkFqcGdeQXVyMTgwOTE5NDk@._V1_QL75_UY281_CR4,0,190,281_.jpg"
10,35 jaar tv show,Documentary,['Documentary'],"Aad van Toor and Bas van Toor talk about filming the television series ""Bassie en Adriaan"".","https://m.media-amazon.com/images/M/MV5BZDU1N2E2ZjMtNjEzNC00Y2U1LWFkYjktODg4YWIxNjhmNjA3XkEyXkFqcGdeQXVyMTU1NTc0MzY@._V1_QL75_UY140_CR35,0,140,140_.jpg"
11,3lab ik moet niks,Movie,['Short'],"Toebie (14) is being raised alternatively: he lives with his parents on a plot of land in France, has never been to school and learns about universal human rights. What impact does this have... Read all","https://m.media-amazon.com/images/M/MV5BOWEwZGNmYzctZmMzOS00YzZmLWE5MzktMjFlMGQ4OTBiZDUyXkEyXkFqcGdeQXVyMjY2NjQ2MDY@._V1_QL75_UY281_CR5,0,190,281_.jpg"
12,5 minuten over,Movie,"['Crime', 'Drama', 'Film-Noir']","A lawyer suffers a guilt complex after getting a murder acquittal for his client, and then finding out she did commit the crime.","https://m.media-amazon.com/images/M/MV5BOGMyYjM3M2UtOGZiMC00NTU3LWE0Y2EtZjUzNDk5NmMyNDIzXkEyXkFqcGdeQXVyMTE2NzA0Ng@@._V1_QL75_UX190_CR0,4,190,281_.jpg"
13,80 jaar oorlog,Documentary,"['Documentary', 'History', 'War']",Seven-part series that outlines the development from the relatively small Dutch uprising to a large-scale 'professional' war. Local stories play an important role in this.,"https://m.media-amazon.com/images/M/MV5BMDAxOGNhYjctNWQ2My00MTZjLWFkNWUtNDI3N2FhNWNkZWYyXkEyXkFqcGdeQXVyNjAzNzExNTk@._V1_QL75_UY281_CR5,0,190,281_.jpg"
14,a very english scandal,Tv,"['Biography', 'Comedy', 'Crime']",British Liberal Party leader Jeremy Thorpe is accused of conspiracy to murder his gay ex-lover and forced to stand trial in 1979.,"https://m.media-amazon.com/images/M/MV5BNTQ5NDI0MTQ0MV5BMl5BanBnXkFtZTgwNDEzNTc1NTM@._V1_QL75_UX190_CR0,0,190,281_.jpg"
15,aarde en ruimte,Movie,"['Drama', 'Horror', 'Sci-Fi']","The first pilot to leave Earth's atmosphere lands, then vanishes; but something with a craving for blood prowls the countryside...","https://m.media-amazon.com/images/M/MV5BMGMxMGU0MjktZWIzNC00MWJhLWIyMTItNDkyYzczOTYyYzA3XkEyXkFqcGdeQXVyNjQzNDI3NzY@._V1_QL75_UX190_CR0,3,190,281_.jpg"
16,adieu bzn,Movie,['Comedy'],A French Catholic couple sees their life get turned upside-down when their four daughters get married to men of different nationalities and religions.,"https://m.media-amazon.com/images/M/MV5BMjI3MDI3MTA0OV5BMl5BanBnXkFtZTgwOTUwNTYxMjE@._V1_QL75_UY281_CR9,0,190,281_.jpg"
17,adieu god,Movie,['Drama'],"A small Indian village: an old man is addicted to watching pornography with his friends. One fine day, he accidentally brings home a DVD with a Godard film inside it. Though his friends were... Read all","https://m.media-amazon.com/images/M/MV5BNTFiNjU5NTUtNTJkNy00YjY4LWFkNjctZTU5NzMyZjdmZGFlXkEyXkFqcGdeQXVyMzI0ODEzNzc@._V1_QL75_UY281_CR11,0,190,281_.jpg"
18,afghanistan the wounded land,Documentary,"['Documentary', 'History']","Look at 40 years of war through the eyes of those who suffer most from it - the women of Afghanistan. The documentary begins in the 1960s, when peace reigns in the Kingdom of Afghanistan. Wh... Read all","https://m.media-amazon.com/images/M/MV5BNDIwYjE4YTYtYzdlMi00NTJmLWI4NGItZjRmNDk3YTc1MGUwXkEyXkFqcGdeQXVyMTcwNTc1Ng@@._V1_QL75_UY281_CR5,0,190,281_.jpg"
19,afscheid van de generaal,Movie,['Drama'],It's the hot summer of 1972. On the 9th floor of a tower block on the outskirts of a Dutch provincial town the sixties finally kicked in. Change is in the air and actually materializes the m... Read all,"https://m.media-amazon.com/images/M/MV5BZTYzM2Q2YjktY2ZlOS00MjZjLTk2MzEtM2I5MjBjNmNmNjIyXkEyXkFqcGdeQXVyMzExODEzNDA@._V1_QL75_UY281_CR5,0,190,281_.jpg"
20,agent hamilton,Series,"['Action', 'Drama', 'Thriller']","In the wake of a series of bombings and cyberattacks in Stockholm, agent Carl Hamilton soon finds himself on a life-threatening mission against an invisible enemy with traces leading to Russ... Read all","https://m.media-amazon.com/images/M/MV5BZTNhYzdhN2MtYjAyOC00MjEzLWFlOGEtN2UwMjVmYWU1ODM1XkEyXkFqcGdeQXVyMTMwOTMzNzU@._V1_QL75_UX190_CR0,2,190,281_.jpg"
21,all inclusive,Movie,['Comedy'],Jacco and Sylvie's shaky marriage is put to the test during their stay at an All-Inclusive resort. Jacco finds it difficult to embrace the All-Inclusive culture and at the same time has to r... Read all,"https://m.media-amazon.com/images/M/MV5BM2Q0NzUyNTMtMjljYS00YmYxLThiMWQtZDhmMjJlODY3YzUyXkEyXkFqcGdeQXVyNDA4NTIwOQ@@._V1_QL75_UY281_CR4,0,190,281_.jpg"
22,alleen op een eiland met hans dorrestijn,Tv,['Reality-TV'],"Hans Dorrestijn is staying on a Wadden Island. While he enjoys nature, he dreads being alone. And when it really gets too much for him, he invites a guest.","https://m.media-amazon.com/images/M/MV5BZTExYzRiNWMtMTQ1OC00MmNmLWFlNGEtZTFiN2RhNWU3MjYyXkEyXkFqcGdeQXVyMTE5NTM5NTU5._V1_QL75_UY281_CR46,0,190,281_.jpg"
23,allemaal familie,Movie,"['Comedy', 'Romance']",Bob and Greta De Jaegher are happily married for 40 years. They can look back on a rich and fulfilled life. Their 2 sons Steve and Carl have a successful life as well. Steve is a talented an... Read all,"https://m.media-amazon.com/images/M/MV5BZGFkZWZlYjktZjU4NS00MmYxLWI5YWEtZjE0NzI5NmQyNDk3L2ltYWdlL2ltYWdlXkEyXkFqcGdeQXVyMTYzNzk1NDQ@._V1_QL75_UY281_CR4,0,190,281_.jpg"
24,als de herinnering komt,Movie,"['Drama', 'Romance']",A couple falls in love and agrees to meet in six months at the Empire State Building - but will it happen?,"https://m.media-amazon.com/images/M/MV5BNDkxODc3MDE3NV5BMl5BanBnXkFtZTcwMzEyMzU3Mg@@._V1_QL75_UX190_CR0,1,190,281_.jpg"
25,altijd klaar voor de tocht,Series,"['Family', 'Sport']","Two teams compete to win a certain prize by answering sports questions. Actors/comedians Marcel Verreck and Horace Cohen lead the teams, which consist of a famous sportsperson and someone wh... Read all","https://m.media-amazon.com/images/M/MV5BM2Q5ZDc0ZmEtOTgwZi00MjhlLTk2MDUtNThjYTk5NGIyM2FhXkEyXkFqcGdeQXVyNTM3MDMyMDQ@._V1_QL75_UY140_CR24,0,140,140_.jpg"
26,an evening with ben cramer,Movie,"['Comedy', 'Crime']","Lulu Danger's unsatisfying marriage takes a turn for the worst when a mysterious man from her past comes to town to perform an event called ""An Evening With Beverly Luff Linn; For One Magica... Read all","https://m.media-amazon.com/images/M/MV5BOWEwZWRkMDgtNGQ3Ny00NmYwLTk0MmQtNDhjYzFkNzRmZmU0XkEyXkFqcGdeQXVyMTMxODk2OTU@._V1_QL75_UX190_CR0,4,190,281_.jpg"
27,apennoten,Movie,['Drama'],"In a film that cuts across documentary and drama sees an exploration of both the dynamics of an industrial behemoth, which operates its own independent environment, and societal dynamics in ... Read all","https://m.media-amazon.com/images/M/MV5BMjIwNjM0NzAtOGM1Yy00ODUwLThmNmMtODk2Yzk0MDRjMTllXkEyXkFqcGdeQXVyMjg1NjgwMzg@._V1_QL75_UY281_CR4,0,190,281_.jpg"
28,arctic circle,Series,"['Crime', 'Drama', 'Thriller']","Arctic Circle (aka Ivalo) is set in the unforgiving polar region, amidst the icy landscapes of Finnish Lapland. In season 1 Nina Kautsalo, a Finnish police officer, finds a dying prostitute ... Read all","https://m.media-amazon.com/images/M/MV5BMDljNDU1ZDEtM2VkOS00NmQ0LTkxYmMtYWVkNDY2ZjIyOTA5XkEyXkFqcGdeQXVyNTQ5MTA1OTQ@._V1_QL75_UX190_CR0,2,190,281_.jpg"
29,art dept,Movie,"['Action', 'Comedy']","""Rambo"" parody in which Topper Harley leads a rescue team into Iraq to save Iraqi war prisoners and all of their previous rescue teams.","https://m.media-amazon.com/images/M/MV5BZjU2ODlmZWMtODEwZS00NTQ0LTk1ZDYtYzk0ZjE3ZGZhMGM0XkEyXkFqcGdeQXVyMTQxNzMzNDI@._V1_QL75_UX190_CR0,2,190,281_.jpg"
30,artmen,Tv,"['Drama', 'Musical']",A modern-day reimagining of one of the classical opera 'Carmen'.,"https://m.media-amazon.com/images/M/MV5BMDA4MjYxZjYtNjYwMC00ZDEyLWE2NGItNTVlOWNiYmM5NjUzXkEyXkFqcGdeQXVyMTQyODg5MjQw._V1_QL75_UX190_CR0,0,190,281_.jpg"
31,babybeestenboel,Movie,"['Animation', 'Adventure', 'Comedy']","When the farmer's away, all the animals play, and sing, and dance. Eventually, though, someone has to step in and run things, a responsibility that ends up going to Otis, a carefree cow.","https://m.media-amazon.com/images/M/MV5BMTU2NDE0ODYyNF5BMl5BanBnXkFtZTcwNjQ3NzAzMQ@@._V1_QL75_UX190_CR0,7,190,281_.jpg"
32,back on track,Documentary,['Documentary'],"9 January 2022, the Stadio Olimpico in Rome. 30 minutes into the first half, Federico Chiesa collapses to the ground, screaming in pain. He has torn the cruciate ligament of his left knee. A... Read all","https://m.media-amazon.com/images/M/MV5BZmQ2ODA1ZmUtN2Y4MS00MGE2LWI5OTctOTdlZGQ4NmFjOTgxXkEyXkFqcGdeQXVyMTA0NTY0NTYy._V1_QL75_UX190_CR0,2,190,281_.jpg"
33,bait,Movie,"['Action', 'Fantasy', 'Horror']",A freak tsunami traps shoppers at a coastal Australian supermarket inside the building - along with 12-foot Great White Sharks.,"https://m.media-amazon.com/images/M/MV5BMTYzNjU4NTc5MV5BMl5BanBnXkFtZTcwNDE0NzAzOA@@._V1_QL75_UY281_CR4,0,190,281_.jpg"
34,bak mee met max,Series,['Drama'],"A drama about one of New York's most prestigious ad agencies at the beginning of the 1960s, focusing on one of the firm's most mysterious but extremely talented ad executives, Donald Draper.","https://m.media-amazon.com/images/M/MV5BNTgxNDZlODQtNDcwOC00NWQ5LTljNWMtMDhjY2U5YTUzMTc4XkEyXkFqcGdeQXVyMDA4NzMyOA@@._V1_QL75_UX190_CR0,2,190,281_.jpg"
35,bang,Series,"['Comedy', 'Romance']",A woman who moves into an apartment across the hall from two brilliant but socially awkward physicists shows them how little they know about life outside of the laboratory.,"https://m.media-amazon.com/images/M/MV5BY2FmZTY5YTktOWRlYy00NmIyLWE0ZmQtZDg2YjlmMzczZDZiXkEyXkFqcGdeQXVyNjg4NzAyOTA@._V1_QL75_UX190_CR0,2,190,281_.jpg"
36,ben ik hier alleen,Tv,['Mystery'],Documentary series in which Georgina Verbaan travels through Europe in search of extraterrestrial life with the help of Bram and Alexander of the Dutch UFO reporting center.,"https://m.media-amazon.com/images/M/MV5BNzliMWVhNmQtMjJiMS00ZjRmLWFmNDktNDAyZTc3YjcxYjA4XkEyXkFqcGdeQXVyNjU3MTkyNTA@._V1_QL75_UX190_CR0,2,190,281_.jpg"
37,beste vrienden,Tv,"['Short', 'Comedy', 'Horror']",Ferry and Robert have been best friends since the beginning of their life's. Robert slowly changes into a zombie after he gets himself into trouble. The big question is: is their friendship ... Read all,"https://m.media-amazon.com/images/M/MV5BMjAzMjY4NTg5Ml5BMl5BanBnXkFtZTgwMDY4NTc2NTE@._V1_QL75_UY281_CR5,0,190,281_.jpg"
38,bezieling,Movie,"['Action', 'Adventure', 'Fantasy']","In the future, Highlander Connor MacLeod must prevent the destruction of Earth under an anti-ozone shield.","https://m.media-amazon.com/images/M/MV5BOWY0ODFiNGQtZWQ2Yi00YTc0LWFhYTUtMmE3NGNhY2FhMmYzXkEyXkFqcGdeQXVyMTQxNzMzNDI@._V1_QL75_UX190_CR0,8,190,281_.jpg"
39,bibian mentel durf te dromen,Movie,"['Short', 'Drama']","Max is crazy about airplanes, all of his young life. As he is getting older, he must decide about his future. What will he do?","https://m.media-amazon.com/images/M/MV5BMjgyYzM2NTYtNmYzYi00ZTMwLTk4MzAtMDY5YTFjZDRlZTFlXkEyXkFqcGdeQXVyMjc0NDUxOA@@._V1_QL75_UY281_CR7,0,190,281_.jpg"
40,bij ron in het pension,Movie,"['Comedy', 'Musical']","When an aspiring barber becomes inadvertently involved in the theft of a valuable diamond, necessity forces him to masquerade as a 12 year-old child - with humorous consequences.","https://m.media-amazon.com/images/M/MV5BODhlMmRiMmUtZjFlNS00MWFlLThlNTEtM2VkOWUwYTU0NjJmXkEyXkFqcGdeQXVyNzc5MjA3OA@@._V1_QL75_UX190_CR0,8,190,281_.jpg"
41,binnenstebuitenland,Movie,"['Animation', 'Adventure', 'Comedy']","After young Riley is uprooted from her Midwest life and moved to San Francisco, her emotions - Joy, Fear, Anger, Disgust and Sadness - conflict on how best to navigate a new city, house, and... Read all","https://m.media-amazon.com/images/M/MV5BOTgxMDQwMDk0OF5BMl5BanBnXkFtZTgwNjU5OTg2NDE@._V1_QL75_UX190_CR0,0,190,281_.jpg"
42,blackspace,Series,"['Crime', 'Drama', 'Thriller']",An ordinary morning at a small-town High School turns into a nightmare when anonymous figures in masks have committed a massacre leaving four dead students.,"https://m.media-amazon.com/images/M/MV5BYWY4NmY5NGYtOTYyNC00NWQ5LWE1Y2EtNDMyODVjYjczYWY5XkEyXkFqcGdeQXVyNDI3NjU1NzQ@._V1_QL75_UX190_CR0,2,190,281_.jpg"
43,blauw bloed,Movie,"['Crime', 'Drama']",Clint de la Roche is an insurance agent of royal decent. This regal playboy is known around the world for his ruthless gun totting methods in sorting out insurance problems.,"https://m.media-amazon.com/images/M/MV5BMDBmMTRiZmEtNDI5Zi00OWM3LThmZmItM2UyOWFmYmIwNjYyXkEyXkFqcGdeQXVyMjE4NzY3Mw@@._V1_QL75_UY281_CR9,0,190,281_.jpg"
44,bloedbroeders,Tv,['Thriller'],"In 1960s Holland, a teenage boy and his two upper class friends are driven to desperate measures when the petty thief they offer refuge decides to blackmail them.","https://m.media-amazon.com/images/M/MV5BMTkyNDIwOTAwNF5BMl5BanBnXkFtZTcwMjA3Mjg5OA@@._V1_QL75_UY281_CR5,0,190,281_.jpg"
45,bloedland,Series,"['Crime', 'Drama', 'Thriller']",Northern Irish police officer DCI Tom Brannick investigates crimes while trying to hide a dark secret from his past.,"https://m.media-amazon.com/images/M/MV5BOTEwODg2MmItMzg0Zi00ZTg3LWI3NDctMWUyM2NlNmUwMDlhXkEyXkFqcGdeQXVyODQ3ODYzMTE@._V1_QL75_UY281_CR5,0,190,281_.jpg"
46,blokhuis extra de jaren 80,Tv,['Music'],"In special episodes of the music program Blokhuis Extra, Leo Blokhuis dives deep into the pop music of the 1980s six weeks in a row. There are reports, vintage clips and short documentaries,... Read all","https://m.media-amazon.com/images/M/MV5BMGJkOGI5MTYtZGI4OS00MjI4LWIyNDItNjVlY2Q4MWM4MDg4XkEyXkFqcGdeQXVyMTE5NTM5NTU5._V1_QL75_UY281_CR156,0,190,281_.jpg"
47,bloodlands,Series,"['Crime', 'Drama', 'Thriller']",Northern Irish police officer DCI Tom Brannick investigates crimes while trying to hide a dark secret from his past.,"https://m.media-amazon.com/images/M/MV5BOTEwODg2MmItMzg0Zi00ZTg3LWI3NDctMWUyM2NlNmUwMDlhXkEyXkFqcGdeQXVyODQ3ODYzMTE@._V1_QL75_UY281_CR5,0,190,281_.jpg"
48,bloot,Documentary,"['Documentary', 'Drama']","Actors are overly self-conscious, unsure of themselves, affected, vain and always thinking about their image. The are never 'real' . Documentary makers have a swearword: ' Actor!', for in a ... Read all","https://m.media-amazon.com/images/M/MV5BYmMyMWM2YWMtN2Q4MS00MjJiLWFiZGItOGFjOTgzOWQ2NTY3XkEyXkFqcGdeQXVyOTk0MDAwMA@@._V1_QL75_UX190_CR0,41,190,281_.jpg"
49,bob de bouwer,Series,"['Animation', 'Comedy', 'Family']","Bob the Builder and his machine team are ready to tackle any project. Bob and the Can-Do Crew demonstrate the power of positive thinking, problem-solving, teamwork, and follow-through. The t... Read all","https://m.media-amazon.com/images/M/MV5BYjcwNWE3ZWQtMGFkYS00MjVlLTk3ZWUtNzE4ZjgzZGYxZjBkXkEyXkFqcGdeQXVyODk1MjAxNzQ@._V1_QL75_UX190_CR0,2,190,281_.jpg"
50,boer ayoub,Tv,['Reality-TV'],"23-year-old Ayoub wants nothing more than to run his own farm one day and has therefore been working on various dairy farms since he was 14 in order to gain experience. In the programme, we ... Read all","https://m.media-amazon.com/images/M/MV5BNmRiZWVhYzUtZDMxYi00MDYyLWJjYzktYTE1NWU1NTA5OWY1XkEyXkFqcGdeQXVyMTE5NTM5NTU5._V1_QL75_UY281_CR155,0,190,281_.jpg"
51,boer zoekt vrouw internationaal,Tv,['Reality-TV'],This series follows multiple farmers who try to search a wife.,"https://m.media-amazon.com/images/M/MV5BYjhlNWRkNzgtYjAyMy00YmFkLWJkNGMtZjFhMjdmNGI4OTI1XkEyXkFqcGdeQXVyMTU1NTc0MzY@._V1_QL75_UY281_CR4,0,190,281_.jpg"
52,boer zoekt vrouw special,Tv,['Reality-TV'],This series follows multiple farmers who try to search a wife.,"https://m.media-amazon.com/images/M/MV5BYjhlNWRkNzgtYjAyMy00YmFkLWJkNGMtZjFhMjdmNGI4OTI1XkEyXkFqcGdeQXVyMTU1NTc0MzY@._V1_QL75_UY281_CR4,0,190,281_.jpg"
53,box 21,Movie,"['Crime', 'Drama', 'Thriller']","A young Romanian woman named Lidia is lured to Sweden with promises of a better life, but is instead forced into prostitution. In search of revenge, her fate is interwoven with police office... Read all","https://m.media-amazon.com/images/M/MV5BMmVlMzJlNmUtYjcwNC00ZTc3LWJjNmYtYWJjNDViYWE4NTJlXkEyXkFqcGdeQXVyMDIyMzc3Mw@@._V1_QL75_UY281_CR1,0,190,281_.jpg"
54,brainstorm,Movie,"['Sci-Fi', 'Thriller']","Researchers develop a system where they can jump into people's minds. But when people involved bring their personal problems into the equation, it becomes dangerous - perhaps deadly.","https://m.media-amazon.com/images/M/MV5BZTg5OTNlOTEtMjFhZC00NWRiLWJlOWQtZTNiNDk3OGIxYmMwXkEyXkFqcGdeQXVyNDk3NzU2MTQ@._V1_QL75_UX190_CR0,2,190,281_.jpg"
55,brainwash,Movie,['Thriller'],It follows a woman who investigates a club's mysterious practices after sensing that her daughter is in trouble after joining it.,"https://m.media-amazon.com/images/M/MV5BZWU5ZmUxMGQtM2QwYi00ZGZjLWFmYjYtOGRmOTZiYWVmYmM3XkEyXkFqcGdeQXVyMTE5NTM5NTU5._V1_QL75_UX190_CR0,0,190,281_.jpg"
56,broeders,Movie,"['Short', 'Drama']",A modern fable about two young men.,"https://m.media-amazon.com/images/M/MV5BMTFlYTRiNjAtNDE2Ni00NGYyLTg1MTQtNThlNzI2ZWRkNzYzXkEyXkFqcGdeQXVyMTA5MTg3NzY@._V1_QL75_UY281_CR156,0,190,281_.jpg"
57,brugklas,Tv,['Drama'],It's about a group of children who are in the 7th grade. They act out stories that really happened to other children from 7th grade.,"https://m.media-amazon.com/images/M/MV5BYzI1MjIzNWItOTRmNC00NmYzLTk5ZjItMjIzMTg1MTNhYzVmXkEyXkFqcGdeQXVyNTQ2OTQ4ODU@._V1_QL75_UY281_CR155,0,190,281_.jpg"
58,bureau rio,Tv,['Crime'],"After being absent for a year, police detective Peter van Opperdoes goes back to work when he gets involved in a murder case. In order to solve the case, he has to work with his replacement,... Read all","https://m.media-amazon.com/images/M/MV5BZjE0ZjFhNjItZGRmMi00ZmE4LTljZTktYWZjZjI4NzdhN2I5XkEyXkFqcGdeQXVyNTkzODI5NjM@._V1_QL75_UX190_CR0,12,190,281_.jpg"
59,bureau sport,Movie,"['Short', 'Comedy', 'Romance']","A matchmaking bureau, run by fierce dame Denise (Sissy Denkova), focuses on finding the wrong partners for clients, instead of the right. Clients seek short-term affairs that exclude the pro... Read all","https://m.media-amazon.com/images/M/MV5BMTYwMTI2NDU3OF5BMl5BanBnXkFtZTgwODIyNTQwMzE@._V1_QL75_UX190_CR0,2,190,281_.jpg"
60,bushpiloten,Movie,['Comedy'],"Sepp and Willy inherit a secluded mountain farm. When they find an old biplane in the barn, they come up with the idea to open a flight school, but they meet the resistance of the mayor of t... Read all","https://m.media-amazon.com/images/M/MV5BMWFjOGM2ZTItYTFhZS00ZWNlLTkyZGEtZWNkMTlhMmIxM2Q1L2ltYWdlL2ltYWdlXkEyXkFqcGdeQXVyNjg5Nzc3NTU@._V1_QL75_UY281_CR4,0,190,281_.jpg"
61,buurman en buurman hebben een nieuw huis,Movie,['Family'],Buurman and Buurman have a new house but everything still goes wrong.,"https://m.media-amazon.com/images/M/MV5BY2E3ODMzYjQtNzQwMi00MzhlLTg2MTYtMzY3ZWJjZTRhNGJjXkEyXkFqcGdeQXVyNDUzMjA5MDI@._V1_QL75_UY281_CR116,0,190,281_.jpg"
62,bztshow,Movie,"['Biography', 'Drama', 'Musical']",Celebrates the birth of show business and tells of a visionary who rose from nothing to create a spectacle that became a worldwide sensation.,"https://m.media-amazon.com/images/M/MV5BMjI1NDYzNzY2Ml5BMl5BanBnXkFtZTgwODQwODczNTM@._V1_QL75_UY281_CR1,0,190,281_.jpg"
63,cafe lazarus,Series,"['Action', 'Drama', 'Fantasy']",Is a top secret organization dedicated to preventing mass extinction events and with the ability to make time go backwards.,"https://m.media-amazon.com/images/M/MV5BYzE4ODZhNTMtYTYyYi00N2JmLTllMDUtMjVlNDRiNTRiYWNhXkEyXkFqcGdeQXVyNDk3ODk4OQ@@._V1_QL75_UX190_CR0,2,190,281_.jpg"
64,cannabis,Movie,"['Biography', 'Comedy', 'Crime']",An eighteen year old high school drop out and his twenty-seven year old friend start trafficking marijuana across the border of Canada in order to make money and their lives are changed fore... Read all,"https://m.media-amazon.com/images/M/MV5BMTQyODM5MDQyOV5BMl5BanBnXkFtZTgwMDQxODc1MTE@._V1_QL75_UX190_CR0,2,190,281_.jpg"
65,caps club,Series,"['Adventure', 'Family']",Sjoerd van Hulle becomes police chief in a Dutch town and moves there with his family and dog. His visually-impaired son Tom makes friends at his new school. A tree house becomes their HQ an... Read all,"https://m.media-amazon.com/images/M/MV5BNmMxYTliZDAtYmNjMy00NTBjLWE0MWItNTY4NDg5ZWE5MmExXkEyXkFqcGdeQXVyMzkwMDAyMA@@._V1_QL75_UY281_CR10,0,190,281_.jpg"
66,carmen meets carmen,Documentary,['Documentary'],A look at what happened after Borat (2006) was filmed in the Romanian village of Glod. It follows the life of one girl who longs to escape the poverty as foreign lawyers arrive with the prom... Read all,"https://m.media-amazon.com/images/M/MV5BMTQ1MTQyMTEyNl5BMl5BanBnXkFtZTgwNDIwMzA2MDE@._V1_QL75_UY281_CR11,0,190,281_.jpg"
67,catch,Movie,"['Biography', 'Crime', 'Drama']","Barely 21 yet, Frank is a skilled forger who has passed as a doctor, lawyer and pilot. FBI agent Carl becomes obsessed with tracking down the con man, who only revels in the pursuit.","https://m.media-amazon.com/images/M/MV5BMTY5MzYzNjc5NV5BMl5BanBnXkFtZTYwNTUyNTc2._V1_QL75_UX190_CR0,0,190,281_.jpg"
68,charlie en lola,Series,"['Animation', 'Family']",Animation following a boy's efforts to get his stubborn little sister to try new things.,"https://m.media-amazon.com/images/M/MV5BMDY5YWNiZTUtOGE3Ni00YTAzLWIwODYtODUzZTZlMGQzN2FhXkEyXkFqcGdeQXVyMTMxODk2OTU@._V1_QL75_UY281_CR6,0,190,281_.jpg"
69,checkpoint,Series,['Comedy'],"Outside of Army Base Fort Stewart, on Checkpoint Charlie, we witness the classic battle between soldiers who skate and soldiers who actually care, there can only be one victor.","https://m.media-amazon.com/images/M/MV5BOTgyNGRhYjAtYzM2Yy00NDIzLTk2NmUtNzIyNDc2NGY1Mzg3XkEyXkFqcGdeQXVyNzM1NTAxMzQ@._V1_QL75_UY281_CR155,0,190,281_.jpg"
70,chica,Movie,"['Crime', 'Drama', 'Mystery']","During the Cavalcade of the Magi parade, the Martín family's daughter Amaya disappears. Journalist Miren takes on the case, determined to find her.","https://m.media-amazon.com/images/M/MV5BODNkMGU1ZDAtNzJmZC00ODBkLThkMDctMjJmNGM4OWMzMDRjXkEyXkFqcGdeQXVyMTU2Mjg2NjE2._V1_QL75_UY281_CR2,0,190,281_.jpg"
71,clangers,Series,"['Animation', 'Family', 'Sci-Fi']","The series chronicled the melancholically funny lives of the Clangers, a flutey-voiced family of woolen, knitted aliens living below the surface of a knobbly little planet far out in space. ... Read all","https://m.media-amazon.com/images/M/MV5BODU4NTY5NTY1OV5BMl5BanBnXkFtZTcwNTQ1OTkxMQ@@._V1_QL75_UY281_CR4,0,190,281_.jpg"
72,clipphanger,Movie,"['Action', 'Adventure', 'Thriller']",A botched mid-air heist results in suitcases full of cash being searched for by various groups throughout the Rocky Mountains.,"https://m.media-amazon.com/images/M/MV5BYWNlYTI0MDctNDdjNS00MmUzLWE4MzYtZTNjOTNjYWJjZmM5XkEyXkFqcGdeQXVyMTUzMDUzNTI3._V1_QL75_UX190_CR0,2,190,281_.jpg"
