,Name,Type,Genres,Description,img_link
287,kinderen voor kinderen live in concert,Movie,['Music'],"In this annual event, the 'Kinderen Voor Kinderen' children's choir performs 12 songs based on ideas sent in by children. The songs make up an album from which the proceeds go to a good caus... Read all","https://m.media-amazon.com/images/M/MV5BZmRiOTRjMDItMDU4Yi00OTljLWFhNGEtODcwY2FhYjU0MDI4XkEyXkFqcGdeQXVyNjExODE1MDc@._V1_QL75_UY281_CR47,0,190,281_.jpg"
288,kinderen voor kinderen tegen pesten,Movie,['Music'],"In this annual event, the 'Kinderen Voor Kinderen' children's choir performs 12 songs based on ideas sent in by children. The songs make up an album from which the proceeds go to a good caus... Read all","https://m.media-amazon.com/images/M/MV5BZmRiOTRjMDItMDU4Yi00OTljLWFhNGEtODcwY2FhYjU0MDI4XkEyXkFqcGdeQXVyNjExODE1MDc@._V1_QL75_UY281_CR47,0,190,281_.jpg"
289,kinderen voor kinderen viert feest,Movie,['Music'],"In this annual event, the 'Kinderen Voor Kinderen' children's choir performs 12 songs based on ideas sent in by children. The songs make up an album from which the proceeds go to a good caus... Read all","https://m.media-amazon.com/images/M/MV5BZmRiOTRjMDItMDU4Yi00OTljLWFhNGEtODcwY2FhYjU0MDI4XkEyXkFqcGdeQXVyNjExODE1MDc@._V1_QL75_UY281_CR47,0,190,281_.jpg"
290,kindertijd,Series,['Family'],KRO Kindertijd was conceived as a sanctuary for toddlers on television by Jan-Willem Bult and followed his philosophy 'Children in the Centre'. It was a daily recurring program block for chi... Read all,"https://m.media-amazon.com/images/M/MV5BNWU1NGM5YmYtMDNlNS00YjAyLTk5MmUtOTVhY2ZjOTUwN2VhXkEyXkFqcGdeQXVyMTAyODU4MzA@._V1_QL75_UY281_CR159,0,190,281_.jpg"
291,klein holland,Series,['Comedy'],"A Dutch-Iranian actor moves in with a Dutch family at the invitation of the mother, only to find the father very small-minded.","https://m.media-amazon.com/images/M/MV5BMDFjMjI0ZWMtMmIwMy00NGUyLTg3YzgtZjliOTU2YjdiYjZiXkEyXkFqcGdeQXVyMjAzNjk4ODU@._V1_QL75_UY140_CR24,0,140,140_.jpg"
292,klem,Movie,"['Crime', 'Drama']",A man who works for the tax authorities ends up becoming friends with a dangerous criminal after their daughters become best friends and he accidentally saves his life.,"https://m.media-amazon.com/images/M/MV5BY2NjY2NhNDMtZDQ0MS00YzY0LWI3MDMtZTEwNzEwODUzNzM5XkEyXkFqcGdeQXVyNTIyODgzMQ@@._V1_QL75_UY281_CR5,0,190,281_.jpg"
293,klikbeet,Series,['Comedy'],Program consisting of short comical sketches.,"https://m.media-amazon.com/images/M/MV5BMjU2ODA5ZjctOTkyZC00NjdjLTk4NTMtYTExNWY5MjQ1YzIyXkEyXkFqcGdeQXVyMTE5NTM5NTU5._V1_QL75_UY207_CR4,0,140,207_.jpg"
294,kloosterserie,Movie,"['Comedy', 'Crime', 'Fantasy']","Coach Cade Buda, a financially desperate 5th grade math teacher and aspiring comic book writer, receives a visit from two ex-Marines that changes all their lives. These friends, Sarge and Mo... Read all","https://m.media-amazon.com/images/M/MV5BNzYyMTc2MjExOV5BMl5BanBnXkFtZTgwNTE0NjA5ODE@._V1_QL75_UY281_CR11,0,190,281_.jpg"
295,knappe koppen,Movie,"['Drama', 'Romance']","A boy's friends frame him after an act of senseless violence, then turn against him for trying to tell the truth.","https://m.media-amazon.com/images/M/MV5BN2E5MmVhMWEtN2ZjMy00MWYzLThmZTYtMTY0MTNmYTgyOGVjXkEyXkFqcGdeQXVyMTEzMjU0NA@@._V1_QL75_UY281_CR4,0,190,281_.jpg"
296,koken met van boven,Movie,"['Animation', 'Adventure', 'Comedy']","While in search of his own shadow, Peter arrives in London of our world, where he meets little Wendy and her brothers Michael and John. He takes his new friends back home to Neverland, where... Read all","https://m.media-amazon.com/images/M/MV5BOTIzNjdjZTAtZWYyNy00NDA2LWFkYzUtY2U2Y2NiNWExZDcwXkEyXkFqcGdeQXVyNzMwOTY2NTI@._V1_QL75_UY281_CR5,0,190,281_.jpg"
297,koken voor de wereld,Tv,['Talk-Show'],"A daily television talk show hosted by Matthijs van Nieuwkerk about relevant news items, politics, music, science, and art.","https://m.media-amazon.com/images/M/MV5BZTk4ZjBhNjUtOWU5MS00Y2ZiLThiOGItOTIzMjAwZWE4ZjY0XkEyXkFqcGdeQXVyNTAyMjE2Njc@._V1_QL75_UY281_CR153,0,190,281_.jpg"
298,komt een aap bij de dokter,Movie,['Comedy'],"Comedy series featuring short skits or sketches, mainly based around sex.","https://m.media-amazon.com/images/M/MV5BNjA1YTcwODYtMjY5MC00ZTU2LWFhNWUtYzE2MWZmYTkwNGY2XkEyXkFqcGdeQXVyMjUyODc2NDA@._V1_QL75_UY281_CR4,0,190,281_.jpg"
299,kop op,Movie,"['Animation', 'Adventure', 'Comedy']","After one experiment, Johnny turns into a monster and everyone else becomes human. Now it has to be seen whether they will be able to reverse this experiment.","https://m.media-amazon.com/images/M/MV5BMDA3NWZlNjUtYzZhMi00ZWYxLWEzNWEtZmYxZjhmOGI0YjBmXkEyXkFqcGdeQXVyMzExODEzNDA@._V1_QL75_UY281_CR8,0,190,281_.jpg"
300,kruispunt,Movie,"['Crime', 'Drama', 'Film-Noir']",Nick Bianco is caught during a botched jewellery heist. The prosecution offer him a more lenient sentence if he squeals on his accomplices but he doesn't roll over on them. Three years into ... Read all,"https://m.media-amazon.com/images/M/MV5BZWZkOTI2MTktZTQ5ZC00ZWFhLWE4ODItYjFlZWJkODZiY2M5XkEyXkFqcGdeQXVyNjc1NTYyMjg@._V1_QL75_UX190_CR0,1,190,281_.jpg"
301,kunstlicht,Movie,"['Drama', 'Sci-Fi']","A highly advanced robotic boy longs to become ""real"" so that he can regain the love of his human mother.","https://m.media-amazon.com/images/M/MV5BNWU2NzEyMDYtM2MyOS00OGM3LWFkNzAtMzRiNzE2ZjU5ZTljXkEyXkFqcGdeQXVyNjU0OTQ0OTY@._V1_QL75_UX190_CR0,2,190,281_.jpg"
302,kunstlicht vi,Movie,"['Drama', 'Sci-Fi']","A highly advanced robotic boy longs to become ""real"" so that he can regain the love of his human mother.","https://m.media-amazon.com/images/M/MV5BNWU2NzEyMDYtM2MyOS00OGM3LWFkNzAtMzRiNzE2ZjU5ZTljXkEyXkFqcGdeQXVyNjU0OTQ0OTY@._V1_QL75_UX190_CR0,2,190,281_.jpg"
303,langs de oevers van de yangtze,Documentary,['Documentary'],Dutch photographer Ruben Terlou travels the banks of the Yangtze to examine how China's economic overhaul affected people's lives.,"https://m.media-amazon.com/images/M/MV5BMzBjMjE0MGYtZGU1Ny00MjMwLWExNzAtMjY0MzQ5MDlhYjU0XkEyXkFqcGdeQXVyMjcyMjg3MTM@._V1_QL75_UY281_CR10,0,190,281_.jpg"
304,langs de rijn,Documentary,['Documentary'],Martin Hendriksma and Huub Stapel make a trip together along the river Rhine. They start at the source in the Swiss Alps. Then Huub and Martin travel further along the Rhine to Hoek van Holl... Read all,"https://m.media-amazon.com/images/M/MV5BOTczYmIyNzUtM2I3ZS00YWRlLWJmNGEtNTE0YmVlM2Q3Mzk4XkEyXkFqcGdeQXVyOTk0MDAwMA@@._V1_QL75_UY281_CR86,0,190,281_.jpg"
305,lekker laat,Documentary,['Documentary'],"Legendary moonshiner Popcorn Sutton demonstrates the art, craft, and character of illegal moonshine distillation in this revered cult-classic.","https://m.media-amazon.com/images/M/MV5BYWY5MjM4OGYtMmJmNy00Mjc0LTg5NDEtNGNhOWZhNzc0YmRhXkEyXkFqcGdeQXVyNTM3MDMyMDQ@._V1_QL75_UY140_CR24,0,140,140_.jpg"
306,leven dood liefde,Movie,['Drama'],"""Life, Love, Death"" was made before the abolition of capital punishment in France. Its central message is the inhumanity of the guillotine. The film, which is shot somewhat in a cinema verit... Read all","https://m.media-amazon.com/images/M/MV5BNGMzNzJlYmEtODNiYi00NTJjLWI4OTEtYzlkNDAyZmJhNDM3XkEyXkFqcGdeQXVyNzgzODI1OTE@._V1_QL75_UY281_CR6,0,190,281_.jpg"
307,leven in de brouwerij,Tv,"['Biography', 'Drama']",The story of ambitious young boy Freddy Heineken and how he became one of the most famous Dutch people ever.,"https://m.media-amazon.com/images/M/MV5BODAwYTllOTMtYTdjNi00MjAxLWEzMGUtZWJjNjM4ZTM5ZjY2L2ltYWdlL2ltYWdlXkEyXkFqcGdeQXVyMzc1MDQ3NQ@@._V1_QL75_UY281_CR17,0,190,281_.jpg"
308,leven voor de dood,Documentary,['Documentary'],"About the harrowing life of the musician, poet and actor Hans van Sweeden (1939-1963), who ended his life at the age of 24. Simultaneously, the film offers a poignant portrait of his contemp... Read all","https://m.media-amazon.com/images/M/MV5BYTZhNDRmOGItMGQ4MC00OTU2LWIxNGYtYWI2MWQxMjIxYTg4XkEyXkFqcGdeQXVyOTE3NDAzMDU@._V1_QL75_UX190_CR0,4,190,281_.jpg"
309,levy iedereen gaat het voelen,Movie,['Drama'],Matteo decides to take a trip across Italy to go visiting his five children.,"https://m.media-amazon.com/images/M/MV5BM2Q3YzcyMjEtYzQwMS00MTY4LWE0MzEtNGM4ZjUwOWIzZmYwXkEyXkFqcGdeQXVyMTE2OTg4Mjg@._V1_QL75_UY281_CR9,0,190,281_.jpg"
310,lex lokaal,Movie,"['Short', 'Drama']","Two transporters for hire wait for the dawn on a country road for a man they've never met to arrive. Upon making the exchange with the stranger, and receiving instructions for their package,... Read all","https://m.media-amazon.com/images/M/MV5BZmVmNGYyNDAtNmY3OC00YWNkLTk1MWYtNzQwMWUxYmI0NWM2XkEyXkFqcGdeQXVyNjA4MDQ2OA@@._V1_QL75_UX140_CR0,0,140,140_.jpg"
311,lieve s s sanne,Documentary,"['Documentary', 'Music']",Pink Floyd's final live show in 1995.,"https://m.media-amazon.com/images/M/MV5BMTYwNTg1NzIwNF5BMl5BanBnXkFtZTcwNTkxNjczMQ@@._V1_QL75_UY281_CR9,0,190,281_.jpg"
312,line of duty,Series,"['Crime', 'Drama', 'Mystery']","Drama series following the investigations of AC-12, a controversial police anti-corruption unit.","https://m.media-amazon.com/images/M/MV5BYTExOTRiZmEtMzBjNi00N2Y2LWEyMWUtYWIwODg2ZjM2NjEyXkEyXkFqcGdeQXVyNDI3NjU1NzQ@._V1_QL75_UY281_CR1,0,190,281_.jpg"
313,lingo,Tv,['Game-Show'],"Lingo is a reboot of the clever, competitive and unpredictable game, which features teams of two as they face off in fast-paced puzzle rounds to guess letters that reveal seemingly simple wo... Read all","https://m.media-amazon.com/images/M/MV5BZWIwMjU5Y2MtN2U2NS00M2UxLTljNzctMWNkYzFjODZiYWQyXkEyXkFqcGdeQXVyMTU1MTUyODMw._V1_QL75_UX190_CR0,0,190,281_.jpg"
314,lois,Series,"['Action', 'Adventure', 'Drama']","The world's most famous superhero and comic books' most famous journalist face the pressures and complexities that come with balancing work, justice, and parenthood in today's society.","https://m.media-amazon.com/images/M/MV5BMzdmYjAyODUtMTFkOS00MDg1LTljMDAtNzhiYTg5NjY1NjM5XkEyXkFqcGdeQXVyMTUzMTg2ODkz._V1_QL75_UY281_CR18,0,190,281_.jpg"
315,lost in the game,Series,['Adventure'],"A group of teenagers are invited to attend a survival camp, but all is not as it seems. One by one some of the children are secretly taken to a hidden part of the camp where they are introdu... Read all","https://m.media-amazon.com/images/M/MV5BMWY2MjhiOGUtZTIwZS00MTg4LWI5M2QtNTE0MmE1ZTM1NzQxL2ltYWdlXkEyXkFqcGdeQXVyNDc4NDk4NTQ@._V1_QL75_UY281_CR92,0,190,281_.jpg"
316,louis theroux weird weekends,Documentary,['Documentary'],"Louis Theroux documents some of the US's most bizarre happenings, events and rituals, by getting involved himself.","https://m.media-amazon.com/images/M/MV5BZjc1NjE4N2YtMzNiOS00NDljLTkxYzMtOGU1NjJhZTUzNzVmXkEyXkFqcGdeQXVyNjg0NTcxMTg@._V1_QL75_UY281_CR4,0,190,281_.jpg"
317,love me gender,Movie,"['Drama', 'Musical', 'Romance']","At the end of the Civil War, a Confederate team is ordered to rob a Union payroll train but the war ends leaving these men with their Union loot, until the Feds come looking for it.","https://m.media-amazon.com/images/M/MV5BNjg5ODNiZmYtZjQ5ZS00ZGU2LTk4MTEtNzdiNWVmYjdhYTAyXkEyXkFqcGdeQXVyMDI2NDg0NQ@@._V1_QL75_UX190_CR0,4,190,281_.jpg"
318,lover of loser,Movie,"['Drama', 'Family']","Eva is afraid of her sex-obsessed stepfather Willem. Feeling forlorn, she meets Ricardo, a streetwise hustler who cheers her up, promising a trip to Paris. But instead he drags her to a sex ... Read all","https://m.media-amazon.com/images/M/MV5BMDk1NmQzYmEtZmE5Yi00NWI5LTkyNmUtNTc4NjZjNmE5MzVhXkEyXkFqcGdeQXVyNzE2MTQyMzM@._V1_QL75_UY281_CR5,0,190,281_.jpg"
319,lowlands 2015,Movie,"['Action', 'Adventure', 'Family']","Bound by a shared destiny, a teen bursting with scientific curiosity and a former boy-genius inventor embark on a mission to unearth the secrets of a place somewhere in time and space that e... Read all","https://m.media-amazon.com/images/M/MV5BMTQ4OTgzNTkwNF5BMl5BanBnXkFtZTgwMzI3MDE3NDE@._V1_QL75_UX190_CR0,0,190,281_.jpg"
320,lowlands 2019,Documentary,"['Documentary', 'Short']","As climate change erases the Louisiana coast, the last two teenagers on Isle de Jean Charles fight to stay on an island that's been their family home for generations.","https://m.media-amazon.com/images/M/MV5BNTRjN2E3ZDMtMjI0OS00MDVmLWFiZmYtMTI4MWJjNGU1ZjkwXkEyXkFqcGdeQXVyOTM3MTUwMDk@._V1_QL75_UY281_CR11,0,190,281_.jpg"
321,man bijt hond,Series,['Comedy'],"As the title ""man bites dog"" indicates, a succession of various unusual, even bizarre topics and characters in Flanders.","https://m.media-amazon.com/images/M/MV5BNzhjZjVmMDYtNWVjNS00YjI4LWE4OGYtNjI1NzdiMzYyYmY5XkEyXkFqcGdeQXVyNjkxODU2ODA@._V1_QL75_UY281_CR7,0,190,281_.jpg"
322,man bijt hond in new york,Series,['Comedy'],"As the title ""man bites dog"" indicates, a succession of various unusual, even bizarre topics and characters in Flanders.","https://m.media-amazon.com/images/M/MV5BNzhjZjVmMDYtNWVjNS00YjI4LWE4OGYtNjI1NzdiMzYyYmY5XkEyXkFqcGdeQXVyNjkxODU2ODA@._V1_QL75_UY281_CR7,0,190,281_.jpg"
323,man bijt hond kijkerskeuze,Series,['Comedy'],"As the title ""man bites dog"" indicates, a succession of various unusual, even bizarre topics and characters in Flanders.","https://m.media-amazon.com/images/M/MV5BNzhjZjVmMDYtNWVjNS00YjI4LWE4OGYtNjI1NzdiMzYyYmY5XkEyXkFqcGdeQXVyNjkxODU2ODA@._V1_QL75_UY281_CR7,0,190,281_.jpg"
324,man bijt hond zondageditie,Series,['Comedy'],"As the title ""man bites dog"" indicates, a succession of various unusual, even bizarre topics and characters in Flanders.","https://m.media-amazon.com/images/M/MV5BNzhjZjVmMDYtNWVjNS00YjI4LWE4OGYtNjI1NzdiMzYyYmY5XkEyXkFqcGdeQXVyNjkxODU2ODA@._V1_QL75_UY281_CR7,0,190,281_.jpg"
325,man en kunst,Documentary,['Documentary'],Fluxus artist Willem de Ridder had arranged a Secret Exhibition without permission or knowledge of the board. All these works disappeared during the renovation of the Stedelijk Museum.,"https://m.media-amazon.com/images/M/MV5BZTc0NzIwNTItNWQ4Mi00NzNkLThmNDAtOGY3MThlODY1YTJjL2ltYWdlXkEyXkFqcGdeQXVyNDIzNTMxNA@@._V1_QL75_UY281_CR26,0,190,281_.jpg"
326,mashas songs,Series,"['Animation', 'Short', 'Adventure']",A retired circus bear settles into the woods and prepares for a quiet new life surrounded by peace and tranquility until he is introduced to an adventurous little girl named Masha.,"https://m.media-amazon.com/images/M/MV5BOTBkNWQ3OWEtYjUyNy00ODBmLWE3ZTMtOWJhZWYyMmE2MGI1XkEyXkFqcGdeQXVyNzMwOTY2NTI@._V1_QL75_UY281_CR1,0,190,281_.jpg"
327,matthaus passion,Documentary,"['Documentary', 'Music']","A labyrinthine narrative in which people relate their special relationship with the music of Bach, with Pieter Jan Leusink's Bach Choir and Orchestra providing the score and a group of homel... Read all","https://m.media-amazon.com/images/M/MV5BMjEzMzU3MTExNV5BMl5BanBnXkFtZTgwNTAwOTQ0NDE@._V1_QL75_UY281_CR4,0,190,281_.jpg"
328,max magic show,Movie,"['Comedy', 'Musical']",A young magician with an unorthodox look and style's first big break is threatened by a villainous rival.,"https://m.media-amazon.com/images/M/MV5BMTcyMTA0MzQ5NF5BMl5BanBnXkFtZTcwMzQ4NDAzMQ@@._V1_QL75_UY281_CR4,0,190,281_.jpg"
329,max vakantieman,Tv,"['News', 'Talk-Show']","The programme MAX vakantieman helps duped travellers with large and small holiday problems. Besides solutions for consumer problems, MAX vakantieman offers various tips and in the section Be... Read all","https://m.media-amazon.com/images/M/MV5BMmEyMzU3YWMtNmRmMC00MGMwLWE2MTgtOWJiOTE2MDYyN2RlXkEyXkFqcGdeQXVyMTE5NTM5NTU5._V1_QL75_UY281_CR157,0,190,281_.jpg"
330,me jane you tarzan,Movie,"['Adventure', 'Drama']","While on an African expedition with her father, Jane Parker meets Tarzan, and the two become fascinated by each other.","https://m.media-amazon.com/images/M/MV5BZGU5ZTUyZmMtZjExYy00MDAzLTljZTEtMGE0MWI5YWFiYTJkXkEyXkFqcGdeQXVyNzc5MjA3OA@@._V1_QL75_UX190_CR0,6,190,281_.jpg"
331,meer voor vrouwen,Movie,"['Drama', 'Music', 'War']","Set in the early '40s, a San Francisco prostitute is run out of town just as the second World War has begun to intensify. Mamie settles down in Hawaii, hoping to start a new life. Though her... Read all","https://m.media-amazon.com/images/M/MV5BYWQ4OWFjMTUtN2RlMC00YjFkLTkyYmItYTllOGY1OTU1MWJmXkEyXkFqcGdeQXVyNjc0MzMzNjA@._V1_QL75_UY281_CR2,0,190,281_.jpg"
332,memories,Movie,"['Crime', 'Drama', 'Mystery']","In a small Korean province in 1986, two detectives struggle with the case of multiple young women being found raped and murdered by an unknown culprit.","https://m.media-amazon.com/images/M/MV5BOGViNTg4YTktYTQ2Ni00MTU0LTk2NWUtMTI4OTc1YTM0NzQ2XkEyXkFqcGdeQXVyMDM2NDM2MQ@@._V1_QL75_UX190_CR0,0,190,281_.jpg"
333,met het mes op tafel,Movie,['Family'],"Dutch quiz show on general knowledge that includes parts of poker, namely betting and bluffing.","https://m.media-amazon.com/images/M/MV5BNzRlNmYxNDItZDZkNC00YWI4LWI2YzUtNzhmODhkYjVmZDQ0XkEyXkFqcGdeQXVyNjg3MTIwODI@._V1_QL75_UY140_CR55,0,140,140_.jpg"
334,metropolis,Movie,"['Drama', 'Sci-Fi']","In a futuristic city sharply divided between the working class and the city planners, the son of the city's mastermind falls in love with a working-class prophet who predicts the coming of a... Read all","https://m.media-amazon.com/images/M/MV5BYzdmM2U4MzYtMDA4My00NmQ5LTkzNDYtZDJhZTM5MjQ4OTlhXkEyXkFqcGdeQXVyMzExODEzNDA@._V1_QL75_UY281_CR2,0,190,281_.jpg"
335,mijn vader,Tv,['Drama'],"When her mother suddenly dies, and her father having been in a mental institution for more than 30 years, 40-something Eva finds herself in an existential crisis.","https://m.media-amazon.com/images/M/MV5BM2Y1OThlN2ItOWRmNC00NTE1LWExY2ItZDRlYmVjMTMyYmMzXkEyXkFqcGdeQXVyNjc3NTYxNDI@._V1_QL75_UY281_CR4,0,190,281_.jpg"
336,mijn vader de gelukszoeker,Documentary,['Documentary'],"Witness the rise and fall of the infamous Dutch hash dealer Jan 'The Peanut' Falize. Son Will was heir to the throne and he takes us into the world of drugs, wealth and violence and shows wh... Read all","https://m.media-amazon.com/images/M/MV5BZTMyMzlhMWUtMDUzNy00NGI5LWIyNDctOGNhNWI5NGMwNzU3XkEyXkFqcGdeQXVyMTUxNzAyOTMx._V1_QL75_UY281_CR5,0,190,281_.jpg"
337,mijn vader is de beste,Documentary,['Documentary'],"Witness the rise and fall of the infamous Dutch hash dealer Jan 'The Peanut' Falize. Son Will was heir to the throne and he takes us into the world of drugs, wealth and violence and shows wh... Read all","https://m.media-amazon.com/images/M/MV5BZTMyMzlhMWUtMDUzNy00NGI5LWIyNDctOGNhNWI5NGMwNzU3XkEyXkFqcGdeQXVyMTUxNzAyOTMx._V1_QL75_UY281_CR5,0,190,281_.jpg"
338,missie aarde,Movie,"['Comedy', 'Sci-Fi']","In 2063, with all of Earth flooded except for the Netherlands, a crew of misfits aboard the Dutch spaceship Tasman are humanity's last and only hope for finding a new home planet.","https://m.media-amazon.com/images/M/MV5BODJkZjBjMDctZjg2OS00NjkxLThhOTUtNDA2ZmM5ODU1NzI0XkEyXkFqcGdeQXVyNTA2NTI0MTY@._V1_QL75_UY281_CR135,0,190,281_.jpg"
339,moby dick,Movie,"['Adventure', 'Drama']","The sole survivor of a lost whaling ship relates the tale of his captain's self-destructive obsession to hunt the white whale, Moby Dick.","https://m.media-amazon.com/images/M/MV5BYzIxOWRlYjQtODQ0MS00NjZhLWJiZTUtZmRjZWI3OGNmMTA1XkEyXkFqcGdeQXVyNTEwNDcxNDc@._V1_QL75_UX190_CR0,5,190,281_.jpg"
340,mokum,Documentary,"['Documentary', 'Short', 'History']",a film on vanished pre-war Jewish Amsterdam,"https://m.media-amazon.com/images/M/MV5BZWQxYmUzOTktN2EwMC00YWRkLWFiYzYtNzM0NWIzOWFhYjMwXkEyXkFqcGdeQXVyNDcxODE1MTM@._V1_QL75_UY281_CR6,0,190,281_.jpg"
341,mondo,Documentary,"['Documentary', 'Horror']","A ""shockumentary"" consisting of a collection of mostly real archive footage displaying mankind at its most depraved and perverse, displaying bizarre rites, cruel behavior and bestial violenc... Read all","https://m.media-amazon.com/images/M/MV5BMmM5Njc1MDAtZGJmMC00MjRiLThmNzktYTk1ODk3MWE3NzU4XkEyXkFqcGdeQXVyMzIwNDY4NDI@._V1_QL75_UY281_CR6,0,190,281_.jpg"
342,moonriders,Series,['Family'],"When everyone is asleep unsuspectingly, traffic lights blink aimlessly and the moon crackles in the night, the Moonriders set out. Artist Aukje Dekker and her friends -young and old- from th... Read all","https://m.media-amazon.com/images/M/MV5BZjI3OTQ3MzYtMWRmOS00OTQyLTgxMTEtNTlmM2MzM2YzMDJlXkEyXkFqcGdeQXVyNTA0NDE3OTI@._V1_QL75_UX190_CR0,2,190,281_.jpg"
343,mr selfridge,Series,"['Drama', 'History']","Centers on the real-life story of the flamboyant and visionary American founder of Selfridge's, London's department store.","https://m.media-amazon.com/images/M/MV5BNGZiNzA5ZjktMjUyZC00ZDRhLWEwZjItMTc2YzcyZTAxYjgxXkEyXkFqcGdeQXVyNDI3NjU1NzQ@._V1_QL75_UX190_CR0,2,190,281_.jpg"
344,muziekfeest van het jaar,Movie,"['Biography', 'Drama', 'History']","Nothing seems to stand in the way of Ad Melkert becoming minister-president of the Netherlands, but everything changes with the turbulent arrival of newcomer Pim Fortuyn.","https://m.media-amazon.com/images/M/MV5BMjEzYzkyMmItZjIxYS00OWZhLTk0ZjMtYTViYTI2NmQ5ODgxXkEyXkFqcGdeQXVyNjc3NTYxNDI@._V1_QL75_UY281_CR5,0,190,281_.jpg"
345,mystrix i,Movie,['Comedy'],The myths of the sixties are satirized in 20 episodes.,"https://m.media-amazon.com/images/M/MV5BMWJmM2QzMmMtN2I5Ny00ODA0LTllNjktMmMxYjI1N2I3MDA2XkEyXkFqcGdeQXVyMjIyMDk1Nzg@._V1_QL75_UY281_CR6,0,190,281_.jpg"
346,mystrix ii,Movie,"['Action', 'Sci-Fi']","Freedom fighters Neo, Trinity and Morpheus continue to lead the revolt against the Machine Army, unleashing their arsenal of extraordinary skills and weaponry against the systematic forces o... Read all","https://m.media-amazon.com/images/M/MV5BZTBlMjZlZTgtNjFlOC00ZDc3LThjYjktNDkyNTUzZjI3NjYxXkEyXkFqcGdeQXVyMzExODEzNDA@._V1_QL75_UX190_CR0,1,190,281_.jpg"
347,na de bevrijding in de klas,Tv,['Drama'],"Mary Michon studied the routine of 6th grade from the back of classrooms for months, to see how children treat one another and think of adults. She visited urban and rural schools; met with ... Read all","https://m.media-amazon.com/images/M/MV5BMTBjMmMxZDUtNDgyNi00Y2FmLTk5YWItMmY4YWFiYTlmZjkyXkEyXkFqcGdeQXVyMTAwMTI1MDM@._V1_QL75_UY281_CR87,0,190,281_.jpg"
348,na ons de zondvloed,Movie,"['Crime', 'Drama']",Self-centered parents of the 50's targeted by drama in which teenagers panicking after burglary supposed to finance the run from the Third World War.,"https://m.media-amazon.com/images/M/MV5BNmM2ZjZmNDAtZWUzOC00NzdkLWEzMGMtOGNhNWRjZDI4ZWJlXkEyXkFqcGdeQXVyMTMyNTc2Mzgx._V1_QL75_UY281_CR17,0,190,281_.jpg"
349,nablijven,Movie,"['Drama', 'Family']","Melissa is a nice and pretty girl with natural dreams and ambitions. But because of bad influences, her life becomes a nightmare. Until her real friends decide to get her out of there.","https://m.media-amazon.com/images/M/MV5BMzM1MGFhNjMtMjg4Zi00OWU1LWI3MjMtNTVjZTFjNjI1NWM0XkEyXkFqcGdeQXVyNzE2MTQyMzM@._V1_QL75_UY281_CR4,0,190,281_.jpg"
350,nachtdieren,Movie,['Drama'],"Pauli is a sexually frustrated young man who's surrounded by sexually liberated women who will not give him the time of day. He meets a beautiful virgin woman, Andrea, who strongly resists h... Read all","https://m.media-amazon.com/images/M/MV5BMTA3ODg5NzcxMTBeQTJeQWpwZ15BbWU4MDU4MjU5MDMx._V1_QL75_UY281_CR11,0,190,281_.jpg"
351,nachtzoen,Movie,"['Action', 'Drama', 'Horror']","Susan (Willeke Van Ammelrooy) lives on an idyllic farmhouse, along with the sex-loving youngsters Sandra, Olga and Julie, and the unstable voyeur Albert. A number of absurd killings take pla... Read all","https://m.media-amazon.com/images/M/MV5BNDcwYmY3ZjktYzAzOC00NDk5LWExZjEtMWY4ZmU5OThmZThjXkEyXkFqcGdeQXVyMjIyNjE2NA@@._V1_QL75_UX190_CR0,66,190,281_.jpg"
352,nederturken,Documentary,['Documentary'],The film describes the author's first detailed encounter with his 72-year-old father and his family during a three-week summer vacation in Turkey.,"https://m.media-amazon.com/images/M/MV5BNDMxMDNmMDMtMzc2Ni00NTcxLWFkNDEtOThlMmJiOTBiMGUzXkEyXkFqcGdeQXVyOTAyMDgxODQ@._V1_QL75_UX140_CR0,0,140,140_.jpg"
353,new generation in concert,Documentary,['Documentary'],"21st century choreographers, dancers and film historians discuss the significance of Singin' in the Rain (1952) to their art form.","https://m.media-amazon.com/images/M/MV5BOWIxNzA5MzYtZGIxNS00NmYwLWFjMDItNjVhNDhmYjdjZTAwXkEyXkFqcGdeQXVyMjI3NjA5NjM@._V1_QL75_UX190_CR0,2,190,281_.jpg"
354,nieuwe film,Documentary,"['Documentary', 'Drama']","A documentary about the fascinating and complicated process of the rebuilding of Holland's most famous museum, The Rijksmuseum. The film shows the people behind the scenes during the years o... Read all","https://m.media-amazon.com/images/M/MV5BMTY4NzQ2Mjg3NF5BMl5BanBnXkFtZTgwNjQxNTI4MjE@._V1_QL75_UY281_CR4,0,190,281_.jpg"
355,nils holgersson,Series,['Animation'],"Nils is a normal farmers boy, until one day he is turned into a miniature boy. Now Nils is as small as the animals around him, he discovers he can talk to them. That's how he gets to know hi... Read all","https://m.media-amazon.com/images/M/MV5BMDdmNmMyZmUtNjMwNi00N2IxLWJjODUtY2JkZWQ4YzlmMzE4XkEyXkFqcGdeQXVyNzE2MTQyMzM@._V1_QL75_UY281_CR1,0,190,281_.jpg"
356,ninja nanny,Series,['Family'],"When awkward preteen Hunter and her patchwork family enter a life of new-found celebrity and move to a posh neighborhood, she is distraught. She hates this snobbish village filled with brats... Read all","https://m.media-amazon.com/images/M/MV5BZDIwMjk4ZGQtNTRmMC00OTA5LTkyNWEtZTk0ZjNhOTA5MjZmXkEyXkFqcGdeQXVyMTU1NTc0MzY@._V1_QL75_UY281_CR7,0,190,281_.jpg"
357,no no,Series,"['Animation', 'Action', 'Adventure']","After his hometown is destroyed and his mother is killed, young Eren Jaeger vows to cleanse the earth of the giant humanoid Titans that have brought humanity to the brink of extinction.","https://m.media-amazon.com/images/M/MV5BNDFjYTIxMjctYTQ2ZC00OGQ4LWE3OGYtNDdiMzNiNDZlMDAwXkEyXkFqcGdeQXVyNzI3NjY3NjQ@._V1_QL75_UY281_CR9,0,190,281_.jpg"
