,Name,Type,Genres,Description,img_link
145,detective van der valk,Series,"['Crime', 'Drama', 'Thriller']",A Dutch detective takes on criminal cases in Amsterdam using insightful human observation and his natural street smarts.,"https://m.media-amazon.com/images/M/MV5BZWJmNDEzZTktYzI1Yi00ODBhLWIwMTYtODlmYzhmMGQxNGMwXkEyXkFqcGdeQXVyMTAwMzM3NDI3._V1_QL75_UY281_CR11,0,190,281_.jpg"
146,dexter new blood,Tv,"['Crime', 'Drama', 'Mystery']","Set 10 years after Dexter Morgan went missing in the eye of Hurricane Laura, he is now living under an assumed name in Upstate New York, Iron Lake, far from his original home in Miami.","https://m.media-amazon.com/images/M/MV5BZjQwNDE3NGUtMjljMi00OWI4LTljYjktZmMyNWJkMTI1NjZhXkEyXkFqcGdeQXVyOTA3MTMyOTk@._V1_QL75_UX190_CR0,2,190,281_.jpg"
147,dianas decades,Documentary,['Documentary'],Three-part documentary series looking at how Princess Diana channelled as well as influenced the zeitgeist at the end of the 20th Century. Examining how she encapsulated the spirit of the ag... Read all,"https://m.media-amazon.com/images/M/MV5BMjJkN2JjNDYtYTBkNS00MmQ4LTlkNzYtMjcxNzU1ZWQyMTU2XkEyXkFqcGdeQXVyMjY4NDQyNDI@._V1_QL75_UX190_CR0,3,190,281_.jpg"
148,dip dap,Series,['Animation'],"Anything can happen in Dipdap's world. A line can become a ghost, a balloon, or even a key that can unlock a whole world of fun and adventure... Drawing is often a much-loved activity in a y... Read all","https://m.media-amazon.com/images/M/MV5BMDY0MGQzNjktNjkyZi00NGVhLWI0NmEtMzgyMmJkMzMzZTI4XkEyXkFqcGdeQXVyNjI0NjA4ODM@._V1_QL75_UY281_CR6,0,190,281_.jpg"
149,dit was het nieuws,Tv,"['Comedy', 'Game-Show']","Harm Edens, Jan Jaap van der Wal en Peter Pannekoek leggen het nieuws van de afgelopen week onder de satirische loep.","https://m.media-amazon.com/images/M/MV5BYzJhNzg1ZmMtYzczZi00NTlhLWJhZjYtODYzZDc1MmRmZjE3XkEyXkFqcGdeQXVyMTgwOTE5NDk@._V1_QL75_UY281_CR6,0,190,281_.jpg"
150,dit zijn wij,Series,['Drama'],"'Dit Zijn Wij' focuses on couple Anna (Fockeline Ouwerkerk) and Johan (Vincent van der Valk), and Katja (Esmée van Kampen), Kasper (Kay Greidanus), and Edgar (Romano Haynes), as they search ... Read all","https://m.media-amazon.com/images/M/MV5BNjYwNDk5OGQtNGIyYS00YTIzLWE0MmMtY2RhZGQ3MGFhMTJmXkEyXkFqcGdeQXVyNTExMzIyNDM@._V1_QL75_UY281_CR2,0,190,281_.jpg"
151,doodstil,Tv,"['Crime', 'Drama', 'Thriller']","Chronicles Luther's first steps in the world of organized crime with his brother in the 90s, while also showing his present day quest to retaliate against an old enemy, together with his nie... Read all","https://m.media-amazon.com/images/M/MV5BOTM2ZGY3YzYtOTY5OS00YzhhLWE3YjItZmU0ZjQxNDQ0YmI4XkEyXkFqcGdeQXVyMzY1OTkyMTY@._V1_QL75_UX190_CR0,28,190,281_.jpg"
152,door het hart van china,Documentary,['Documentary'],"Dutch photographer Ruben Terlou and director Maaik Krijgsman travel through China, from Inner Mongolia in the north, the tropical coast of Macau in the South, talking to Chinese people about... Read all","https://m.media-amazon.com/images/M/MV5BYzQ3NDQyZTEtM2QwNC00OWFlLWFmOGItNTJiNTdiMjM0OWE3XkEyXkFqcGdeQXVyNTc0OTUzOTg@._V1_QL75_UY281_CR10,0,190,281_.jpg"
153,dossier geschiedenis de gouden eeuw,Tv,['Comedy'],Dorine interviews several people from the Dutch golden age who tell her about themselves and the time they lived in.,"https://m.media-amazon.com/images/M/MV5BNjBjOTgxNjEtNzViNi00Zjg1LWI3NDAtZTUwN2M1ZTA5OTJlXkEyXkFqcGdeQXVyNjY5Mzc0MTU@._V1_QL75_UY281_CR4,0,190,281_.jpg"
154,downton abbey,Series,"['Drama', 'Romance']",A chronicle of the lives of the British aristocratic Crawley family and their servants in the early twentieth century.,"https://m.media-amazon.com/images/M/MV5BY2U1NmIwYzgtNjFkOS00YWUxLTg0YTMtZmE5NTA3YjRmY2NlXkEyXkFqcGdeQXVyNTA4NzY1MzY@._V1_QL75_UY281_CR4,0,190,281_.jpg"
155,draadstaal,Tv,['Comedy'],A weekly comedy sketch show featuring multiple recurring and new characters.,"https://m.media-amazon.com/images/M/MV5BYzQ3NjA3MmMtYWM2Yy00NzAyLWE0MmQtOWVlMTI4OTUzNzNiL2ltYWdlL2ltYWdlXkEyXkFqcGdeQXVyMjIzMTk0MzM@._V1_QL75_UY281_CR9,0,190,281_.jpg"
156,dragons den,Tv,"['Game-Show', 'Reality-TV']","Budding entrepreneurs, inventors, and small businessmen (and -women) pitch their ideas to the five ""dragons""--real-life business leaders and millionaires, with real cash to invest in the com... Read all","https://m.media-amazon.com/images/M/MV5BYWIwMzE0MTAtMmY1Mi00YTBkLWFhNzgtOTdiN2Q1YTk1MzU5XkEyXkFqcGdeQXVyMzU3MTc5OTE@._V1_QL75_UY281_CR1,0,190,281_.jpg"
157,dubbelspel,Movie,"['Action', 'Adventure', 'Crime']","After assuming his dead cell-mate's identity to get with the other man's girlfriend, an ex-convict finds himself a reluctant participant in a casino heist.","https://m.media-amazon.com/images/M/MV5BZjNmNWIwZTAtMjM1MS00ODNiLTljYzMtNGI1ZmRkMmIxYzJiXkEyXkFqcGdeQXVyMTQxNzMzNDI@._V1_QL75_UX190_CR0,0,190,281_.jpg"
158,duivelse dilemmas,Movie,"['Short', 'Drama']",Vital (16) is confronted with the fact that her pissed best friend posted a very sexy photo of her.,"https://m.media-amazon.com/images/M/MV5BYmU3YWFlZmYtMTAwZi00Y2I1LTliYzItYzAzYTQ3MGY4NjIwXkEyXkFqcGdeQXVyMjc5MjE4NA@@._V1_QL75_UY281_CR5,0,190,281_.jpg"
159,dunya desie,Movie,"['Comedy', 'Drama']","The story of two 18-year old best friends who grew up together in the suburbs of Amsterdam. Dunya is Moroccan, grown up with Ramadan, imams and Mecca. Desie is as Dutch as cheese and tulips.... Read all","https://m.media-amazon.com/images/M/MV5BZTlkMmZiYmItY2VmOC00NmUyLWFjNzEtZTM0MTdkOGY0M2UxXkEyXkFqcGdeQXVyNzE2MTQyMzM@._V1_QL75_UY281_CR4,0,190,281_.jpg"
160,dus ik ben,Movie,"['Crime', 'Drama', 'Thriller']","Two young women, marginalised by society, go on a destructive tour of sex and violence. Breaking norms and killing men - and shattering the complacency of polite cinema audiences.","https://m.media-amazon.com/images/M/MV5BMTc5MzMxMzM5OV5BMl5BanBnXkFtZTYwMDk0MTk4._V1_QL75_UX190_CR0,5,190,281_.jpg"
161,dwars door afrika,Documentary,['Documentary'],"Bram Vermeulen travels through South Africa, Zimbabwe, Zambia and Angola exploring change. He travels by train, moped and Rolls Royce and rediscovers the southern tip of the continent.","https://m.media-amazon.com/images/M/MV5BYmU0ODEyOGYtNTVjZi00YWIxLTg4NDMtNTk2NDVhNjZjZmRmXkEyXkFqcGdeQXVyOTk0MDAwMA@@._V1_QL75_UY281_CR8,0,190,281_.jpg"
162,dwars door de middellandse zee,Documentary,['Documentary'],"Arnout Hauben sets off on a new hiking adventure through Belgium and the Netherlands. He will hike from Ostend to Pieterburen, in the far north of the Netherlands, together with his friends ... Read all","https://m.media-amazon.com/images/M/MV5BNTg0MGRlN2UtNjJhYi00NjI2LTljMmYtYzgwZDllMDhiMDM2XkEyXkFqcGdeQXVyMTE5NTM5NTU5._V1_QL75_UY140_CR24,0,140,140_.jpg"
163,dwdd guilty pleasures,Tv,"['Mystery', 'Thriller']","Two beautiful women who live in the same apartment building each have a shocking story to tell. On the first floor lives Silvia Resino, who has three psychotic admirers while on the second f... Read all","https://m.media-amazon.com/images/M/MV5BMTc0MzIxMzg4OF5BMl5BanBnXkFtZTcwOTA0MzcyMQ@@._V1_QL75_UY281_CR4,0,190,281_.jpg"
164,echtscheiding,Movie,['Comedy'],Dick Van Dyke and Debbie Reynolds star as a suburban couple who learn that not even divorce can solve all their problems.,"https://m.media-amazon.com/images/M/MV5BZmVhYzAzODItMTg0Ny00NDVkLWFiNTQtZDc3ZjRkMDlhYzJmXkEyXkFqcGdeQXVyMTQ3Njg3MQ@@._V1_QL75_UX190_CR0,2,190,281_.jpg"
165,een andere kijk,Movie,"['Short', 'Fantasy']","Ben, a young boy with a keen and curious mind, stumbles upon a charming little toyshop in the heart of a Maltese village. Intrigued by its potential mysteries, he wanders in.","https://m.media-amazon.com/images/M/MV5BNzNiODQ0MTgtOGQyNC00NjZjLWFmNTMtNWFhMzkwZmQ3ZTY4XkEyXkFqcGdeQXVyODYwNzQ2Ng@@._V1_QL75_UY281_CR11,0,190,281_.jpg"
166,een huis vol,Movie,"['Comedy', 'Fantasy', 'Romance']","A modern-day witch likes her neighbor but despises his fiancée, so she enchants him to love her instead.","https://m.media-amazon.com/images/M/MV5BMDQ3ODM1YzYtYTZiMy00YWQxLWE2MzAtYWVlM2Q5OWRhYmExXkEyXkFqcGdeQXVyMTMxMTY0OTQ@._V1_QL75_UY281_CR2,0,190,281_.jpg"
167,een nacht met mijn ex,Documentary,"['Documentary', 'Short', 'Biography']",The mother (Lotje Ruting) of the filmmaker tells about how her life has gone when she first came to live in a poorly maintained canal house fifty years ago. The rapid career of the father (A... Read all,"https://m.media-amazon.com/images/M/MV5BNmEwMTIzNDctOTJhOC00MTc4LTkxNDctYjA5ZmM0MGZiNTQ0XkEyXkFqcGdeQXVyMjkwOTgxODI@._V1_QL75_UY281_CR156,0,190,281_.jpg"
168,een nieuwe jas live,Movie,"['Animation', 'Comedy', 'Drama']","Under the cherry blossom tree during Sakuragaoka High School's Entrance Ceremony, Miou Aida meets Haruki Serizawa for the first time. Ever since that day, their eyes chased after each other.... Read all","https://m.media-amazon.com/images/M/MV5BMDEzYTdlNDctYzZiYi00ZTNkLWI1MmItMjI4YWIwZTJhZTA4XkEyXkFqcGdeQXVyNjc3MjQzNTI@._V1_QL75_UY281_CR4,0,190,281_.jpg"
169,een sjtetl in de cariben,Movie,"['Adventure', 'Sci-Fi']","After uncovering a mysterious artifact buried beneath the Lunar surface, a spacecraft is sent to Jupiter to find its origins - a spacecraft manned by two men and the supercomputer H.A.L. 900... Read all","https://m.media-amazon.com/images/M/MV5BMmNlYzRiNDctZWNhMi00MzI4LThkZTctMTUzMmZkMmFmNThmXkEyXkFqcGdeQXVyNzkwMjQ5NzM@._V1_QL75_UX190_CR0,0,190,281_.jpg"
170,eenvandaag politicus van het jaar,Movie,"['Biography', 'Drama', 'History']","Nothing seems to stand in the way of Ad Melkert becoming minister-president of the Netherlands, but everything changes with the turbulent arrival of newcomer Pim Fortuyn.","https://m.media-amazon.com/images/M/MV5BMjEzYzkyMmItZjIxYS00OWZhLTk0ZjMtYTViYTI2NmQ5ODgxXkEyXkFqcGdeQXVyNjc3NTYxNDI@._V1_QL75_UY281_CR5,0,190,281_.jpg"
171,ehbo,Tv,"['Documentary', 'Reality-TV']",Parenting expert Jo Frost goes around America helping parents deal with their children's behavior.,"https://m.media-amazon.com/images/M/MV5BZDVlMjAxNjItYzU0OC00ZTJhLThlYzEtNWQwMTI1OGRiZDhmXkEyXkFqcGdeQXVyMTkxNjUyNQ@@._V1_QL75_UX190_CR0,2,190,281_.jpg"
172,ella oscar hoo,Series,"['Animation', 'Family']","A smart bubbly girl, a bouncy little boy and a very young cloud : here are Ella, Oscar and Hoo. Together they will chase dinosaurs, explore mysterious woods, or be Santa's devoted assistants... Read all","https://m.media-amazon.com/images/M/MV5BNWQwNTU0M2QtZjc1ZS00OGQ1LTgzYjUtZWE2M2FjYWNiN2EzXkEyXkFqcGdeQXVyNjcyNjg3NjQ@._V1_QL75_UY281_CR11,0,190,281_.jpg"
173,ellie in de handel,Movie,['Drama'],Emanuelle goes undercover in the world of White Slave Trade.,"https://m.media-amazon.com/images/M/MV5BYTYwZTc4NWItZjBjMS00NzRjLWFlMzQtNDJmZTY4MWMxNDIzXkEyXkFqcGdeQXVyMzIwNDY4NDI@._V1_QL75_UY281_CR5,0,190,281_.jpg"
174,eng,Movie,['Drama'],"The show was based in Toronto, they are a news station that go out filming news worthy stories all the while a romance brewing with the news show director & camera man, Jake.","https://m.media-amazon.com/images/M/MV5BMTQ4Nzk1MDkzOV5BMl5BanBnXkFtZTcwNTUxMzM2OQ@@._V1_QL75_UY281_CR13,0,190,281_.jpg"
175,eo life,Series,"['Comedy', 'Drama']","After 18 years behind bars, Miri Matteson returns home and stumbles back into adult life in the claustrophobic coastal town she once knew in this half-hour comedy series.","https://m.media-amazon.com/images/M/MV5BNjJkZDdmNjEtOTc0ZC00ZjNmLTgwMzUtMDg3Y2Q5YmQ5YmFlXkEyXkFqcGdeQXVyOTA3MTMyOTk@._V1_QL75_UX190_CR0,2,190,281_.jpg"
176,ersin in wonderland in de klas,Tv,"['Family', 'Fantasy', 'Musical']","After being surprised by the rain while strolling through the park, the three girls of K3 decide to go the movies together. When they are sitting watching ""Alice in Wonderland"" they all get ... Read all","https://m.media-amazon.com/images/M/MV5BODlkOTViODYtNzYwZS00ZGIwLWJlYWItYWViN2RiMGE1MzZkXkEyXkFqcGdeQXVyNzE2MTQyMzM@._V1_QL75_UY281_CR6,0,190,281_.jpg"
177,even tot hier,Tv,"['Comedy', 'Game-Show', 'Music']","After their successful turn on De kwis (2013), the musical comedy duo 'Van der Laan and Woe' returns with Miguel Wiels and his band in this mashup of political satire, news parody, live musi... Read all","https://m.media-amazon.com/images/M/MV5BNDBkNGI1YTQtNjM2OS00YjgyLThhNzQtMzg4NGI3ZDY4YmM4XkEyXkFqcGdeQXVyOTk0MDAwMA@@._V1_QL75_UY281_CR46,0,190,281_.jpg"
178,evi co,Series,['Family'],Evi is six years old and lives with her parents and Grandpa Co in a small village in the Netherlands. Her parents have a big second-hand store next to their home. They buy and sell old furni... Read all,"https://m.media-amazon.com/images/M/MV5BYzNiZjgwZWYtNDU3MS00NzBmLWI0M2YtYzVmYmNiY2FkOWIwXkEyXkFqcGdeQXVyMTAyODU4MzA@._V1_QL75_UY281_CR104,0,190,281_.jpg"
179,exit,Series,"['Crime', 'Drama', 'Thriller']",A dark drama series based on true stories from Norway's financial scene.,"https://m.media-amazon.com/images/M/MV5BMzhmZGQ2NTUtYzA5Ni00NGFlLTljODAtYTk4NDA2ZTMzMjY4XkEyXkFqcGdeQXVyMTI5NjYwNDQ@._V1_QL75_UY281_CR8,0,190,281_.jpg"
180,exportbaby,Tv,['Drama'],A Dutch couple finds out the truth about the adoption of their daughter from Uganda.,"https://m.media-amazon.com/images/M/MV5BYmVlNmZkZDQtOGUxZi00ZjczLTlhZTEtYmJlNjY5MDI2NmQ3XkEyXkFqcGdeQXVyMzY1OTkyMTY@._V1_QL75_UY281_CR11,0,190,281_.jpg"
181,extreem leven,Series,"['Action', 'Adventure', 'Comedy']",Join an esteemed naturalist for the six episode web series: Extreme Wilderness Pro with Jerry Loven. Learn about nature and wilderness survival in the Pacific Northwest.,"https://m.media-amazon.com/images/M/MV5BMTY5NmMzM2EtZTBjMi00MTE0LWI1YWQtMjMzMTdkN2RjNzg5XkEyXkFqcGdeQXVyNjkwMzc2OTc@._V1_QL75_UY281_CR6,0,190,281_.jpg"
182,fame academy,Tv,"['Family', 'Game-Show', 'Music']","Reality program where talented musicians enter a house to live with each other for the following weeks. Only one will emerge winner, with a £1million contract, mansion, brand new car and a c... Read all","https://m.media-amazon.com/images/M/MV5BMTU2NTM3OTg1Ml5BMl5BanBnXkFtZTcwMDgxNTQyMQ@@._V1_QL75_UY281_CR6,0,190,281_.jpg"
183,family drop,Movie,"['Comedy', 'Short']",Pa Droppington sneaks out of the house to go to the theatre. Amid comic capers he is smitten by a dancer. Meanwhile his son is telling Ma that he's in love with a dancer! She is not happy bu... Read all,"https://m.media-amazon.com/images/M/MV5BMTM0Mjc0MDUzNV5BMl5BanBnXkFtZTcwNTU1NDE2Mw@@._V1_QL75_UY281_CR46,0,190,281_.jpg"
184,feuten,Movie,"['Drama', 'Romance']","Butcher Wagtmans's son Bram joins prestigious Dutch frat Mercurius and becomes best mates with slick silver-spoon womanizing senior Olivier de Ruyter, who helps him survive the hazing and in... Read all","https://m.media-amazon.com/images/M/MV5BMTg2YTQ2MDQtYTEwZi00ZTBmLWI0YzMtNDVmYTQyNjNkMTYyXkEyXkFqcGdeQXVyMTQyMTMwOTk0._V1_QL75_UY281_CR1,0,190,281_.jpg"
185,filemon op de wallen,Series,"['Adventure', 'Family']","REMI, NOBODY'S BOY tells the story of 13-year-old orphan Remi's incredible journey to find his family. He was a foundling; his mother Betty found him left behind in a supermarket when he was... Read all","https://m.media-amazon.com/images/M/MV5BNzhhYjcwMDItZWNkMy00MzJmLWIzYWEtNmNiYWJkY2U0NjNmXkEyXkFqcGdeQXVyNjYxOTY5OTI@._V1_QL75_UY281_CR158,0,190,281_.jpg"
186,finale,Movie,"['Biography', 'Drama', 'History']",A team of secret agents set out to track down the Nazi officer who masterminded the Holocaust.,"https://m.media-amazon.com/images/M/MV5BYzE1YjI2MjctZTY2Zi00NDBhLWIzYmMtNzMzMDgwZjE4MzUxXkEyXkFqcGdeQXVyNTI4MzE4MDU@._V1_QL75_UX190_CR0,0,190,281_.jpg"
187,first dates,Movie,"['Comedy', 'Drama', 'Romance']",Henry Roth is a man afraid of commitment until he meets the beautiful Lucy. They hit it off and Henry think he's finally found the girl of his dreams until discovering she has short-term mem... Read all,"https://m.media-amazon.com/images/M/MV5BMjAwMzc4MDgxNF5BMl5BanBnXkFtZTYwNjUwMzE3._V1_QL75_UX190_CR0,0,190,281_.jpg"
188,first dates specials,Tv,"['Reality-TV', 'Romance']","""First Dates - Promi-Spezial"" is a celebrity special of First Dates - Ein Tisch für zwei (2018) on RTL Deutschland. It's the german version of Celebrity First Dates (2016).","https://m.media-amazon.com/images/M/MV5BMTM4MDI1YjItMWE5NS00MWNkLWJlNDUtYmRiMjdiNzRjOTdjXkEyXkFqcGdeQXVyMTI2MzU1Nzcw._V1_QL75_UY140_CR55,0,140,140_.jpg"
189,flikken rotterdam,Movie,['Drama'],"Detective Ben Slagter gets into trouble after an encounter with a home invader. Meanwhile, the other detectives respond to a drug-related call and end up in an equally-troublesome situation.... Read all","https://m.media-amazon.com/images/M/MV5BMzJiN2RlMzctYjU2Yi00M2Y2LWEzNzYtYTFiZmU5MTYxZmRjXkEyXkFqcGdeQXVyNTExMzIyNDM@._V1_QL75_UY281_CR12,0,190,281_.jpg"
190,floortje naar het einde van de wereld,Tv,"['Adventure', 'Reality-TV']",Dutch travel expert Floortje Dessing travels to the most remote places on earth the meet people how life there.,"https://m.media-amazon.com/images/M/MV5BZTYwMmUwYjEtYTQ0ZC00MWZmLWJlZmEtYTE1ZDBjZDY1OWNjXkEyXkFqcGdeQXVyNjY5Mzc0MTU@._V1_QL75_UY281_CR3,0,190,281_.jpg"
191,floortje terug naar het einde van de wereld,Tv,"['Adventure', 'Reality-TV']",Dutch travel expert Floortje Dessing travels to the most remote places on earth the meet people how life there.,"https://m.media-amazon.com/images/M/MV5BZTYwMmUwYjEtYTQ0ZC00MWZmLWJlZmEtYTE1ZDBjZDY1OWNjXkEyXkFqcGdeQXVyNjY5Mzc0MTU@._V1_QL75_UY281_CR3,0,190,281_.jpg"
192,floris,Series,"['Action', 'Adventure', 'History']","A Dutch television series that is about an exiled knight and his Indian friend. Together they try to get his birth right papers back from an evil Lord. During their quest, they get help from... Read all","https://m.media-amazon.com/images/M/MV5BYzZlZTgxODAtZjliYS00YTVhLWIwMmMtYWQ2NjIxMGFiZmJlXkEyXkFqcGdeQXVyMjM2ODYwMQ@@._V1_QL75_UY281_CR9,0,190,281_.jpg"
193,fons bij de buren,Movie,"['Animation', 'Adventure', 'Comedy']","A scheming raccoon fools a mismatched family of forest creatures into helping him repay a debt of food, by invading the new suburban sprawl that popped up while they were hibernating...and l... Read all","https://m.media-amazon.com/images/M/MV5BMTQwMTQxNTcwOF5BMl5BanBnXkFtZTcwMzQ1NzUzMQ@@._V1_QL75_UX190_CR0,0,190,281_.jpg"
194,forever young,Movie,"['Drama', 'Romance', 'Sci-Fi']","During a cryogenics test, a pilot frozen in 1939 awakes in 1992 but time is running out, as his body starts to age rapidly.","https://m.media-amazon.com/images/M/MV5BYjIzMzYyNzYtMzVjYi00Njg0LThmOTItOGFjMjAyM2IwM2RhXkEyXkFqcGdeQXVyNjMwMjk0MTQ@._V1_QL75_UX190_CR0,2,190,281_.jpg"
195,fotostudio de jong 5,Movie,"['Action', 'Adventure', 'Fantasy']","After the Rebels are overpowered by the Empire, Luke Skywalker begins Jedi training with Yoda, while his friends are pursued across the galaxy by Darth Vader and bounty hunter Boba Fett.","https://m.media-amazon.com/images/M/MV5BYmU1NDRjNDgtMzhiMi00NjZmLTg5NGItZDNiZjU5NTU4OTE0XkEyXkFqcGdeQXVyNzkwMjQ5NzM@._V1_QL75_UX190_CR0,7,190,281_.jpg"
196,freaknacht,Movie,"['Action', 'Adventure', 'Fantasy']","Teenager Darren Shan meets a mysterious man at a freak show who turns out to be a vampire. After a series of events, Darren must leave his normal life and go on the road with the Cirque du F... Read all","https://m.media-amazon.com/images/M/MV5BMTI1NDA1MTMwNl5BMl5BanBnXkFtZTcwNTg0MDE4Mg@@._V1_QL75_UX190_CR0,0,190,281_.jpg"
197,freek de jonge,Tv,['Comedy'],"In his 90th performance, Freek de Jonge plays an elderly gentleman who tries to survive in an increasingly crazier world. Averse to laws and conventions, he would rather burst than bend. Doe... Read all","https://m.media-amazon.com/images/M/MV5BZWRiZjZhNzAtOWU4Ny00OGY5LWIzM2EtZTc5NzdjMTg1YmY4XkEyXkFqcGdeQXVyMTE5NTM5NTU5._V1_QL75_UY281_CR2,0,190,281_.jpg"
198,geboeid terug naar de plantage,Movie,['Thriller'],A woman tries to escape a stalker by moving with her children to her sister's isolated beach house.,"https://m.media-amazon.com/images/M/MV5BNTM5OGEwMDgtZWY5Ny00M2ExLTk0YjEtMmE0MzRjMjVjYjQxXkEyXkFqcGdeQXVyMzExODEzNDA@._V1_QL75_UY281_CR4,0,190,281_.jpg"
199,gehaktdag,Movie,"['Comedy', 'Short']",Life in the supermarket.,"https://m.media-amazon.com/images/M/MV5BZTMzY2RmNTAtNjY3OC00NTkzLWJmY2ItYmRiNDYzMjBhZjFiXkEyXkFqcGdeQXVyMzg1ODEwNQ@@._V1_QL75_UY281_CR4,0,190,281_.jpg"
200,gevoel voor tumor,Movie,"['Comedy', 'Drama']",Tristan Devriendt is a successful med school student and a true womanizer. Everything in his life seems perfect and he's trying to get one of the rare internship places with a prestigious ne... Read all,"https://m.media-amazon.com/images/M/MV5BNDJmMTFmYmEtYjRiNC00ODNmLTlkYjEtM2VmMTg5YzgyMGVmXkEyXkFqcGdeQXVyODY1MjA5MzY@._V1_QL75_UX190_CR0,0,190,281_.jpg"
201,gold digger,Tv,['Thriller'],"A wealthy older woman falls in love with a younger man, but is the relationship all that it seems?","https://m.media-amazon.com/images/M/MV5BOGRlNTU1ZjItMWEzMC00NjlkLWFjMDktMDNhN2E0MThhMDNhXkEyXkFqcGdeQXVyOTIxNTU1Mzc@._V1_QL75_UY281_CR46,0,190,281_.jpg"
202,gosta,Movie,"['Comedy', 'Drama']",Gösta is a 28-year-old child psychologist who gets his first job in a small rural area. He moves from Stockholm and rents a cabin in the middle of the forest. Gösta wants to be the nicest pe... Read all,"https://m.media-amazon.com/images/M/MV5BOGM1NGIzYWEtMGIxNi00NzY3LWIwZmItMjgyNTk4NjU3MmFjXkEyXkFqcGdeQXVyMjMyNjYxMw@@._V1_QL75_UY281_CR4,0,190,281_.jpg"
203,grantchester,Series,"['Crime', 'Drama', 'Mystery']",A Cambridgeshire clergyman finds himself investigating a series of mysterious wrongdoings in his small village of Grantchester.,"https://m.media-amazon.com/images/M/MV5BY2Q5Y2NhZDYtMDYzNC00ODE0LTgwNTktMDdmODM5MzIxOTJlXkEyXkFqcGdeQXVyMTMxNjUyMDkx._V1_QL75_UX190_CR0,2,190,281_.jpg"
204,greatest hits of the 80s,Tv,['Music'],A retrospective celebrating bestselling singles from across the 80s.,"https://m.media-amazon.com/images/M/MV5BZDZlZmE2MDYtNDU4NS00NWMzLTg3NGUtZDc0NmQ4NGM5NTkzXkEyXkFqcGdeQXVyMTE5NTM5NTU5._V1_QL75_UY281_CR156,0,190,281_.jpg"
205,grenslanders,Movie,"['Crime', 'Drama', 'Thriller']","In a remote border area between the Netherlands and Belgium, a wandering girl is found. Her identity is a great mystery.","https://m.media-amazon.com/images/M/MV5BZjQ5N2EzM2ItMGQ2OC00NzJhLTlkMGQtMmRhNmQ2Y2JhNzkxXkEyXkFqcGdeQXVyMTMxODk0MTI@._V1_QL75_UY281_CR4,0,190,281_.jpg"
206,greta thunberg a year to change the world,Documentary,['Documentary'],The 17-year-old's environmental campaigning and her journey into adulthood.,"https://m.media-amazon.com/images/M/MV5BZTk3NjU4NGMtNDE1Yi00M2RmLWEwN2EtNzIyOGI1ZTc5MmE2XkEyXkFqcGdeQXVyMTAyMjQ3NzQ1._V1_QL75_UX190_CR0,2,190,281_.jpg"
207,greyzone,Series,"['Drama', 'Thriller']","A character-driven drama and thriller series about the events leading to a terror attack in Scandinavia, Eastern Europe.","https://m.media-amazon.com/images/M/MV5BODkxNDZmYmMtZjNiYS00OWQxLTkzZTAtYWQyODI3NjdlNmQ5XkEyXkFqcGdeQXVyMTQyMTMwOTk0._V1_QL75_UX190_CR0,2,190,281_.jpg"
208,grimassen,Documentary,['Documentary'],"'Jim Carrey, Unmasked America' tells the story of a transgressive actor, a pirate who came to crack America's too perfect mask to reveal its most infantile and moronic face, right in the hea... Read all","https://m.media-amazon.com/images/M/MV5BNmY0MDQ2YmItZTRmYS00ODcyLTg5ZDMtMzJlNmUwNTdhMGRmXkEyXkFqcGdeQXVyMjIwNjIxNjc@._V1_QL75_UY281_CR155,0,190,281_.jpg"
209,grizzy en de lemmingen,Tv,"['Comedy', 'Family']","The adventures of a Little Grey Fergie tractor with a magical spark plug which makes him a living being, and his ""family"" and the people working on their farm.","https://m.media-amazon.com/images/M/MV5BMjEwMzM4ODc1Ml5BMl5BanBnXkFtZTgwMDA2MjU0NzE@._V1_QL75_UY281_CR4,0,190,281_.jpg"
210,grobbebollen maken lol,Series,['Animation'],"in this animated spin-off series from Tita Tovenaar, Borer and Geeltje are having fun in the air castle, which leads to slapstick, Tom and Jerry -like cartoons. 26 episodes of 2,5 minutes","https://m.media-amazon.com/images/M/MV5BOTM2ZmEwNzctNjYzMy00YjliLWEzODEtZTM3MzA4MzNlYjdiXkEyXkFqcGdeQXVyMjU0MjEwMTk@._V1_QL75_UY281_CR4,0,190,281_.jpg"
211,groenland,Movie,"['Action', 'Thriller']",A family struggles for survival in the face of a cataclysmic natural disaster.,"https://m.media-amazon.com/images/M/MV5BMzcyMzU4MDUtM2JhOC00ZDg2LTg5MGMtZjc2OGMyMjhlMGE2XkEyXkFqcGdeQXVyMTkxNjUyNQ@@._V1_QL75_UX190_CR0,0,190,281_.jpg"
212,grote vragen,Tv,['Talk-Show'],Four kids go on an investigation to find answers to life's big questions.,"https://m.media-amazon.com/images/M/MV5BNmFhZDE5ZTUtN2NiNy00MjU1LTgwODMtMTU1OTU5YzM2NDVmXkEyXkFqcGdeQXVyMTAyODU4MzA@._V1_QL75_UY281_CR140,0,190,281_.jpg"
213,guilt,Series,"['Comedy', 'Crime', 'Drama']","Two brothers accidentally run over and kill an old man. They cover their tracks, but their lives start to fall apart when neighbors and relatives of the dead doubt the way he died.","https://m.media-amazon.com/images/M/MV5BNTA0ZTkzNzYtZGY4Ni00NTQ0LWJlZjQtMmQzODc4Yjk0YWNhXkEyXkFqcGdeQXVyMTUyMzg5NzM2._V1_QL75_UX190_CR0,2,190,281_.jpg"
214,hard spel,Tv,['Game-Show'],"A quiz show hosted by Dutch comedian Richard Groenendijk, who in each episode gets to quiz and mock four contestants, each of whom has selected a specialist subject area. The winner gets to ... Read all","https://m.media-amazon.com/images/M/MV5BYmU5ZDYwNTAtNWNmNi00YjRjLWFkNWMtM2Q5ZWM3MTUwYzliXkEyXkFqcGdeQXVyMTYwNjY3Njcy._V1_QL75_UY281_CR155,0,190,281_.jpg"
215,he frans he stef,Movie,['Drama'],Step Dad is refused sex from his Wife and after fighting He turns to his Step Daughter for Love.,"https://m.media-amazon.com/images/M/MV5BZjIwZTJjMTQtMzEzOS00NDY4LTlhMGQtNjQwOTYxMzk4ZWRhXkEyXkFqcGdeQXVyMTA3ODAyNjI0._V1_QL75_UY140_CR35,0,140,140_.jpg"
216,heel holland bakt,Tv,['Reality-TV'],A group of home-bakers compete to become Holland's best home-baker.,"https://m.media-amazon.com/images/M/MV5BMzQzMGNhY2YtNzVhMi00MzkyLTllM2ItMDY0MzkwYmVjNzE3XkEyXkFqcGdeQXVyNjc3NTYxNDI@._V1_QL75_UY281_CR5,0,190,281_.jpg"
