,Name,Type,Genres,Description,img_link
358,no offence,Series,"['Crime', 'Drama', 'Mystery']","Follows a group of police officers on the front line wondering what they did to end up where they are now, on the ugly side of Manchester.","https://m.media-amazon.com/images/M/MV5BNjVjN2I3MjItYjkzMy00OGIxLWEyMWMtZGUwMmQ0NWJkNTEyXkEyXkFqcGdeQXVyOTMyODgwOTQ@._V1_QL75_UY281_CR4,0,190,281_.jpg"
359,noord zuid,Series,['Crime'],"North-South is about Dana, a female detective working in Amsterdam and using her background as a psychologist to solve crimes. After her divorce from Walter she tries to shape her life again... Read all","https://m.media-amazon.com/images/M/MV5BMGJjNTZmNWQtNGRjYS00YjBlLThiOTMtOThkZTZlMzljZjQ1XkEyXkFqcGdeQXVyNzE2MTQyMzM@._V1_QL75_UY281_CR5,0,190,281_.jpg"
360,nos amerika kiest,Movie,"['Adventure', 'Drama', 'Thriller']","An ambitious scholar becomes the ambassador of Sarkan, a southeast Asian country where civil war is brewing.","https://m.media-amazon.com/images/M/MV5BYzkzYTQzYTItMzhhYy00YzNiLWEzMDUtYmNlMWU1MTVhZDFjXkEyXkFqcGdeQXVyNjY1NTQ0NDg@._V1_QL75_UX190_CR0,3,190,281_.jpg"
361,nos inhuldiging koning willem alexander met gebarentolk,Tv,"['Short', 'Music']","Music video for K3's song, 'Koning Willem-Alexander'.","https://m.media-amazon.com/images/M/MV5BZWQzYjVkOTAtYmE3MS00NWI2LTg2NmEtMjZhZjZiZTBhM2IyXkEyXkFqcGdeQXVyMTIzODgzODAw._V1_QL75_UX190_CR0,0,190,190_.jpg"
362,nos jeugdjournaalnl,Tv,['News'],A Dutch daily news broadcast intended for children,"https://m.media-amazon.com/images/M/MV5BNTIzNWJkNDktYjM4NC00YzUyLTlmZTgtYjVlZjdkYTAwNzU2XkEyXkFqcGdeQXVyMjI3OTA1NDU@._V1_QL75_UY281_CR182,0,190,281_.jpg"
363,nos op 3,Movie,"['Animation', 'Short']","Prosopagnosia uses expressive animation to investigate intimacy, communication and memory. Prosopagnosia means face-blindness and to understand this neurodiverse behaviour, the contents of a... Read all","https://m.media-amazon.com/images/M/MV5BOTVkM2FjZTEtZWZkOC00ZTEyLTg1OTUtZTk4MWMxNzBkODIxXkEyXkFqcGdeQXVyMTAxNjY3OQ@@._V1_QL75_UY281_CR5,0,190,281_.jpg"
364,nos studio sport,Series,['Sport'],"This show contains news, highlights and coverage of recent major sport events.","https://m.media-amazon.com/images/M/MV5BMmY2NzFkYTQtMzkyNi00ZjBmLTg1YjctMDhkY2I2NzY2NjkzXkEyXkFqcGdeQXVyMTgwOTE5NDk@._V1_QL75_UY281_CR15,0,190,281_.jpg"
365,nos studio voetbal,Tv,"['Sport', 'Talk-Show']",The host and some regular guests discuss recent events and developments in Dutch and international soccer leagues.,"https://m.media-amazon.com/images/M/MV5BNDBiZTEyMjQtMWM2Yi00NjJmLWEzYTItMWFjNWEzMDkwYjMyXkEyXkFqcGdeQXVyNjAzNzExNTk@._V1_QL75_UY281_CR155,0,190,281_.jpg"
366,nos uit het leven 2019,Movie,"['Drama', 'Fantasy', 'Romance']","What if you lived your entire life in one day and would have just one time to enjoy each moment: first kiss, going to school, growing up, making love. In Marc de Cloe's Life in One Day, Benn... Read all","https://m.media-amazon.com/images/M/MV5BZTEyYWMwYmQtNDE1Mi00OWUyLTkxM2UtZjJmOTZmNTQwZGFjXkEyXkFqcGdeQXVyMTgwOTE5NDk@._V1_QL75_UY281_CR5,0,190,281_.jpg"
367,ntr podium einstein on the beach,Movie,['Music'],"Eschewing conventional narrative, a Philip Glass opera based loosely on pacifist Einstein's relationship to the atomic bomb's creation. Châtelet Theatre France production and first ever film... Read all","https://m.media-amazon.com/images/M/MV5BN2VjM2NlNTUtODAxNi00MTMzLTg5NDMtODMyNDBhYmVhYjNhXkEyXkFqcGdeQXVyMjg3NTY4Nw@@._V1_QL75_UY281_CR8,0,190,281_.jpg"
368,o dennenboom,Movie,"['Family', 'Adventure', 'Animation']",Bewildering adventures when Kalle Stropp and Grodan Boll sets out to rescue Kottefolket who live in the forest. Together with Plåt-Niklas and Papegojan they set out in search of bad guys ..,"https://m.media-amazon.com/images/M/MV5BNGI4MzM5ODUtMDEyNC00Njc2LTljNWUtNjlhMzI5NTBlM2E0XkEyXkFqcGdeQXVyMTQzMjU1NjE@._V1_QL75_UY281_CR3,0,190,281_.jpg"
369,ohanlons helden,Documentary,"['Documentary', 'Biography']",Author and adventurer Redmond O'Hanlon travels around the world in the footsteps of his nineteenth century heroes: explorers.,"https://m.media-amazon.com/images/M/MV5BMjhlY2QyMTQtOTY1My00YzRkLWIxNDQtNTNmYzg1MDU3ODc5XkEyXkFqcGdeQXVyMTI1ODY0MjE@._V1_QL75_UY140_CR55,0,140,140_.jpg"
370,ok en knul,Tv,['Reality-TV'],"Documentary series following competitors in the brutal but compelling Bare Knuckle Boxing Scene. In this exciting series, we follow some of the most-notorious bare knuckle boxers as they tra... Read all","https://m.media-amazon.com/images/M/MV5BMzIzODFlYzAtNGQ4ZC00OTQxLTlmY2YtNmE4YjI5OTNmOTk2XkEyXkFqcGdeQXVyODI4NTc2OTA@._V1_QL75_UY281_CR155,0,190,281_.jpg"
371,omdat ik het zeg,Tv,"['Comedy', 'Reality-TV']","'Did You Get the Message?', is a fresh new hidden camera comedy format all about getting a message across in the most unique and memorable way ever.","https://m.media-amazon.com/images/M/MV5BM2U2Njc1YzItYjU5Yi00Yzg0LWJjNWQtMjU0NTBhZTY3YzUzXkEyXkFqcGdeQXVyNzY4Mjc2NDE@._V1_QL75_UY281_CR93,0,190,281_.jpg"
372,one night stand,Movie,"['Drama', 'Romance']","Max/W.Snipes has a one night stand with Karen/N.Kinski in NYC. He returns to his wife, 2 kids and career in LA but is affected. A year later, Max and Karen meet again by chance, but this tim... Read all","https://m.media-amazon.com/images/M/MV5BYmM0ODFjZGEtYWQ2YS00NTk1LTkwODYtYTdjY2NkZDgzMzgwXkEyXkFqcGdeQXVyNjMwMjk0MTQ@._V1_QL75_UY281_CR2,0,190,281_.jpg"
373,onze boerderij,Movie,['Family'],Nestled in lavender fields is a lovely little farm where sisters Jill and Jacky nurture and love all their animals-including the talking ones.,"https://m.media-amazon.com/images/M/MV5BZTcwNTkyNjMtOTJhNy00NDVmLWJjZmEtZmJiN2IwNWE0NjcwXkEyXkFqcGdeQXVyMTA3MTI2ODc5._V1_QL75_UX190_CR0,2,190,281_.jpg"
374,onze jongens op java,Documentary,['Documentary'],"Journalist and historian Coen Verbraak interviews fourteen veterans. Including Joop Hueting, who in 1969 was the first to report war crimes committed by the Dutch.","https://m.media-amazon.com/images/M/MV5BMDEzOTY3MGEtMjFiZC00NDQwLTg5NTgtZmQyNWQyYzdlYjlmXkEyXkFqcGdeQXVyOTk0MDAwMA@@._V1_QL75_UY281_CR155,0,190,281_.jpg"
375,onze man in teheran,Documentary,['Documentary'],"Dutch journalist Thomas Erdbrink has been living in Iran for more than 10 years. Going beyond the usual stereotypes, he sheds his light on the country.","https://m.media-amazon.com/images/M/MV5BZDBhMmYxNTItZTE2YS00ZjhhLWI1MzItNTVhNDA1YjZkZGRkXkEyXkFqcGdeQXVyMjcyMjg3MTM@._V1_QL75_UY281_CR8,0,190,281_.jpg"
376,oosterscheldes odyssee de wereldreis van een windjammer,Movie,['Drama'],"While visiting her uncle in Alberta, Boston-born Kathy O'Fallon meets Canadian Mountie Mike Flannigan. They fall in love, marry, and go north to Mike's new posting. Together, they face and d... Read all","https://m.media-amazon.com/images/M/MV5BOGYzNWI0ZmQtZjYxNy00ODY1LWIxNWYtMDg3NWJhOWRlNzdjXkEyXkFqcGdeQXVyNzc5MjA3OA@@._V1_QL75_UX190_CR0,1,190,281_.jpg"
377,op de dijk,Tv,['Drama'],"After a disturbing call from his mother, Johan has no other choice but to leave Norway and return to the hometown he left many years ago. Back in Volendam, Johan must face the past from whic... Read all","https://m.media-amazon.com/images/M/MV5BZGFkMWYwMDctZGQ2OC00NzIwLThiYzQtNThjZDBlYjE2ZTk2XkEyXkFqcGdeQXVyMzk3MjE4OTY@._V1_QL75_UY281_CR6,0,190,281_.jpg"
378,op zoek naar de israelische keuken,Movie,['Animation'],"Holland's most popular children's characters Woozle and Pip, set out on a fantastic new adventure in their first feature length film. A journey full of friendship, adventure and happiness.","https://m.media-amazon.com/images/M/MV5BMTY3MzExNTQ2OV5BMl5BanBnXkFtZTgwNzI5MjYxNzE@._V1_QL75_UY281_CR4,0,190,281_.jpg"
379,op zoek naar geluk,Movie,"['Short', 'Adventure', 'Drama']","The year is 1850 and everyone in Gorgola is searching for gold. The land is divided into four districts. One of these districts is the home of Anne and Rick, two of the few people that haven... Read all","https://m.media-amazon.com/images/M/MV5BMjEwNjk2NDAtZjI3Ni00NzVlLWEwNDgtYmQzMjFjNGU5ZmQ3XkEyXkFqcGdeQXVyNTUyNjU2MDQ@._V1_QL75_UY281_CR6,0,190,281_.jpg"
380,op1,Tv,['Talk-Show'],"Talk-show hosted by five alternating duos, live from Amsterdam.","https://m.media-amazon.com/images/M/MV5BNGIxM2FiY2MtMjBkMi00ZWJhLWEwZDgtMzYxYjA3NzAyNGJmXkEyXkFqcGdeQXVyNjU3MTkyNTA@._V1_QL75_UX190_CR0,2,190,281_.jpg"
381,operatie obesitas,Tv,['Reality-TV'],"Olivier Locadia, better known as rapper Willie Wartaal, takes the viewers into the world of stomach reductions.","https://m.media-amazon.com/images/M/MV5BNzJjNjRkOGItNTczMy00NzI2LWExYmQtZGIwYTk3ODNjM2ZlXkEyXkFqcGdeQXVyMTE5NTM5NTU5._V1_QL75_UY281_CR155,0,190,281_.jpg"
382,opium,Movie,"['Comedy', 'Drama', 'Musical']","The thwarted loves of Jean Cocteau and Raymond Radiguet, in the early 1920s. The death of Radiguet who did Cocteau sink in opium. A story under the influence of drug. A narrative description... Read all","https://m.media-amazon.com/images/M/MV5BNTJmYTEwNDEtYzJjMi00ZjFmLTgyZTMtNmQ1YzU3YWUwZGQ2XkEyXkFqcGdeQXVyNTcwMDU1MzY@._V1_QL75_UY281_CR11,0,190,281_.jpg"
383,opium weet wat er speelt,Documentary,['Documentary'],"Horst Wendlandt tells the story of his cinematic work, since the sixties. The dialogue between the ""old and the young filmmaker"" creates a fascinating spectrum of German film of the recent p... Read all","https://m.media-amazon.com/images/M/MV5BMTMxNzcyOTE2MF5BMl5BanBnXkFtZTYwMzU3NTEz._V1_QL75_UX140_CR0,0,140,140_.jpg"
384,otje,Tv,"['Adventure', 'Family']",Otje and irritable father Tos live in the attic of the almost bankrupt hotel The Koperwiek where Tos works as a cook. Otje is a boyish girl who love the outdoors. She has a secret tree house... Read all,"https://m.media-amazon.com/images/M/MV5BZmM1MTJhNzQtNDYxMS00ZTEzLWJjZTUtY2UzYTgyMjcyZGQyXkEyXkFqcGdeQXVyNjExODE1MDc@._V1_QL75_UY281_CR4,0,190,281_.jpg"
385,oude koeien,Movie,"['Comedy', 'Western']","Bambino tries to teach his brother Trinity how to become an outlaw, but the two wind up saving a pioneer family and breaking up an arms ring instead.","https://m.media-amazon.com/images/M/MV5BNWUxNjNlM2ItZmIzNi00MDE0LTgxZDAtZmI5NDY2MjFlY2Y1XkEyXkFqcGdeQXVyMzExODEzNDA@._V1_QL75_UY281_CR33,0,190,281_.jpg"
386,outcry,Documentary,"['Documentary', 'Crime']","A five-part documentary series examining the gripping story of high school football star Greg Kelley who was arrested, convicted and jailed for sexual assault of a 4-year-old boy, and his su... Read all","https://m.media-amazon.com/images/M/MV5BMzQzNTEwMDYtMzRhNy00MjdkLThlNjQtNTU1OTM4NzU1ZjJhXkEyXkFqcGdeQXVyOTA3MTMyOTk@._V1_QL75_UY281_CR11,0,190,281_.jpg"
387,papadag,Series,['Drama'],Four fathers meet at the sandbox and decide to spend part of their 'daddy's day' together in the park every week.,"https://m.media-amazon.com/images/M/MV5BOThjNzhkY2YtZTU3YS00Y2M0LTg4YzYtODgyZDRlODI1NmFmXkEyXkFqcGdeQXVyMTQ0OTIwMjk@._V1_QL75_UY281_CR116,0,190,281_.jpg"
388,pasen in rome,Movie,"['Comedy', 'Romance']","Beth is a young, ambitious New Yorker who is completely unlucky in love. However, on a whirlwind trip to Rome, she impulsively steals some coins from a reputed fountain of love, and is then ... Read all","https://m.media-amazon.com/images/M/MV5BMmViZDQ0OGEtNDJlZS00ZmM0LTk2MTItY2NmNGI4NTliOTg1XkEyXkFqcGdeQXVyNjU0NTI0Nw@@._V1_QL75_UX190_CR0,0,190,281_.jpg"
389,paul rosenmoller en de lijsttrekkers,Movie,['Crime'],The actual life and the fiction created by a successful pulp author begin to blend together.,"https://m.media-amazon.com/images/M/MV5BMWU4ZTRiYzgtN2Q4NC00NzFhLTkxZTctZTFmNmY1NDU5NWFjXkEyXkFqcGdeQXVyODI0MjkwOQ@@._V1_QL75_UY281_CR4,0,190,281_.jpg"
390,pauw specials,Tv,['Comedy'],"Witchipoo and the Wicked Witch of the West give Paul Lynde three wishes for Halloween. KISS performs three songs. Florence Henderson sings a disco version of ""That Old Black Magic.""","https://m.media-amazon.com/images/M/MV5BMTkzOTE0MTM1M15BMl5BanBnXkFtZTcwODI1NDE3Mg@@._V1_QL75_UY281_CR5,0,190,281_.jpg"
391,penoza,Series,"['Crime', 'Drama', 'Thriller']","After her husband is assassinated, housewife Carmen reluctantly has to take charge of the criminal business of her family.","https://m.media-amazon.com/images/M/MV5BMTM0NWJmNTEtN2NlNy00YzYyLWI5MzktM2RkZTY2NWM4NGI3XkEyXkFqcGdeQXVyNzE2MTQyMzM@._V1_QL75_UY281_CR15,0,190,281_.jpg"
392,peppa pig,Series,"['Animation', 'Adventure', 'Comedy']",A little pig named Peppa and her little brother George have journeys everyday with their family and friends.,"https://m.media-amazon.com/images/M/MV5BNDUyODQ0NjAtYTZjMS00MzBjLWI1ZjYtMzBhYzgyYzdjMTE4XkEyXkFqcGdeQXVyMzU5OTE2NTI@._V1_QL75_UY281_CR1,0,190,281_.jpg"
393,petrus in het land,Movie,"['Action', 'Adventure', 'Drama']","Hamilan, a cruel and ambitious general, murders his king and places himself on the throne with the former king's evil niece as his queen. He then wages war against his peaceful neighbors, ki... Read all","https://m.media-amazon.com/images/M/MV5BMzEwZTlmNDAtY2ZlOS00OWNiLThjZWMtY2VjNmMwZmZkNGMzXkEyXkFqcGdeQXVyNDUxNjc5NjY@._V1_QL75_UX190_CR0,5,190,281_.jpg"
394,pim pom,Tv,"['Animation', 'Adventure', 'Family']",The friendship between the impulsive and adventurous Pim and the more cautious Pom is put to the test when they are faced with trying to find their way home.,"https://m.media-amazon.com/images/M/MV5BNDI5MDhkZmQtZGUwNC00OTkwLWEyNGYtMDRmMThkNDEzOGM4XkEyXkFqcGdeQXVyMTgwOTE5NDk@._V1_QL75_UY281_CR5,0,190,281_.jpg"
395,pingu,Series,"['Animation', 'Short', 'Comedy']","""Pingu finds himself in tricky and comical situations, but he always learns a lesson. Pingu spends his days with his parents and baby sister, Pinga. Everyone in his town speaks """"Penguinese.... Read all","https://m.media-amazon.com/images/M/MV5BNWYzZjZiNTEtODU1MC00NGM4LWI4ZmEtNjgzYTA1OWM3NzIyXkEyXkFqcGdeQXVyMTQ4NTcxNTI0._V1_QL75_UY281_CR2,0,190,281_.jpg"
396,pingu in de stad,Movie,['Drama'],Three young friends grow up as students in Amsterdam when the death of one's father puts everything into a new perspective.,"https://m.media-amazon.com/images/M/MV5BYjY1ZmUwZTYtZjI2YS00YWQwLTk4YTQtMzhhYjI2OGQyYTMyXkEyXkFqcGdeQXVyMjQ3NzUxOTM@._V1_QL75_UY281_CR4,0,190,281_.jpg"
397,pointer special,Movie,"['Animation', 'Action', 'Comedy']","City Hunter, Saeba Ryo, after months of idleness, finally scores a client and it is none other than the beautiful Mega City TV newscaster, Sayaka, who fears for her life. What's more, the en... Read all","https://m.media-amazon.com/images/M/MV5BNWI4Mjk4NjktMmQ5MS00NTFjLTk3Y2YtNmE4NDVkYmQ4MTJlXkEyXkFqcGdeQXVyMzkzODQwMA@@._V1_QL75_UY281_CR3,0,190,281_.jpg"
398,politicologica,Documentary,['Documentary'],An investigation into the life of Pier Paolo Pasolini and the political background of his murder.,"https://m.media-amazon.com/images/M/MV5BYmIyNzRmZTMtNWU2Mi00MzhmLTljNDMtY2M3MTA0ODk1YjNhXkEyXkFqcGdeQXVyMzA1ODcxMDQ@._V1_QL75_UY281_CR4,0,190,281_.jpg"
399,pop4kids,Movie,"['Short', 'Drama']","Luka, Aleks, Tasnim and Freya are a tightly-knit group. At the beginning of their long-awaited future, an unplanned act of violence drives the four to the edge of their friendship.","https://m.media-amazon.com/images/M/MV5BYzQ1MjhkODctMTE3Yi00YWI2LTg1YjctNTcxMzEwNzRkMTVmXkEyXkFqcGdeQXVyMTI4MzE1OTQx._V1_QL75_UY281_CR5,0,190,281_.jpg"
400,popcafe,Movie,['Drama'],A housewife who is unhappy with her life befriends an old lady at a nursing home and is enthralled by the tales she tells of people she used to know.,"https://m.media-amazon.com/images/M/MV5BOWQ1ZWE0MTQtMmEwOS00YjA3LTgyZTAtNjY5ODEyZTJjNDI2XkEyXkFqcGdeQXVyNjE5MjUyOTM@._V1_QL75_UX190_CR0,0,190,281_.jpg"
401,powlitie,Movie,"['Action', 'Comedy']","Ria Khan believes that she must save her older sister Lena from her impending marriage. After enlisting her friends' help, she attempts to pull off the most ambitious of all wedding heists, ... Read all","https://m.media-amazon.com/images/M/MV5BM2RjMjU0NDMtMmM2MS00MTRmLWI1YmMtZWQwZjUxNzZhMWEyXkEyXkFqcGdeQXVyMTQzNTA5MzYz._V1_QL75_UX190_CR0,0,190,281_.jpg"
402,pownews,Tv,['News'],"A daily show with provoking news reports, often presented as amusement.","https://m.media-amazon.com/images/M/MV5BM2ZlM2MzZTItOTIwNC00ZWFlLWIwNjMtYWNiMjMxNTQ2NDU2XkEyXkFqcGdeQXVyMjIzMTk0MzM@._V1_QL75_UX140_CR0,0,140,140_.jpg"
403,pride and prejudice,Movie,"['Drama', 'Romance']","Sparks fly when spirited Elizabeth Bennet meets single, rich, and proud Mr. Darcy. But Mr. Darcy reluctantly finds himself falling in love with a woman beneath his class. Can each overcome t... Read all","https://m.media-amazon.com/images/M/MV5BMTA1NDQ3NTcyOTNeQTJeQWpwZ15BbWU3MDA0MzA4MzE@._V1_QL75_UX190_CR0,0,190,281_.jpg"
404,pride talk,Tv,['Talk-Show'],"Brandon ""B-doe"" Thomas delivers important topics in the world of entertainment. His viral show has been very successful with over 3 Million views in total. He can be funny and sometimes cont... Read all","https://m.media-amazon.com/images/M/MV5BYTZkODU4MWQtNTVhNi00N2IwLTkxOGYtYzA2MTA1NDNhMTM5XkEyXkFqcGdeQXVyODMyOTgxNzQ@._V1_QL75_UY281_CR167,0,190,281_.jpg"
405,project rembrandt,Tv,['Reality-TV'],A Dutch TV series in which 50 amateur artists compete to be named the best amateur painter of Holland.,"https://m.media-amazon.com/images/M/MV5BMTBhZTQ3MWYtYjlhNC00ZTUyLWE1NzktYjU1NmVkMDI3MmFhXkEyXkFqcGdeQXVyMzE2NTkxNTk@._V1_QL75_UY281_CR4,0,190,281_.jpg"
406,putin a russian spy story,Documentary,"['Documentary', 'Biography']",A definitive account of Putin's power and how it changed the modern world.,"https://m.media-amazon.com/images/M/MV5BODNmYmYzYjgtNjViOC00NzU4LTliYTktYmI2ZDQ2MWQzMWE0XkEyXkFqcGdeQXVyNTg2MDUzNjY@._V1_QL75_UY281_CR155,0,190,281_.jpg"
407,queer amsterdam,Series,['Drama'],Dutch drama series on LGBTQ+ youth in Amsterdam.,"https://m.media-amazon.com/images/M/MV5BZGRkYTYwMTAtYzgyMC00YWYxLThkY2YtYTZhYzFhZDkyNzQ3XkEyXkFqcGdeQXVyMTE3MjA1MTQx._V1_QL75_UX140_CR0,12,140,140_.jpg"
408,radeloos,Movie,['Drama'],"Distraught is a Dutch film from 2008 by Dave Schram at the scenario of Mary Peters among others Marius Gottlieb, Marloes van der Wel, Renée Soutendijk, Monic Hendrickx and Victor Löw. The sc... Read all","https://m.media-amazon.com/images/M/MV5BMTU0NmY5OTYtNmQyNy00YjE0LWE3YjktYzRhOWRhZWJiMDc4XkEyXkFqcGdeQXVyMTgwOTE5NDk@._V1_QL75_UY281_CR6,0,190,281_.jpg"
409,rebecka martinsson,Series,"['Crime', 'Drama', 'Mystery']",When a childhood friend suddenly dies Rebecka Martinsson returns home to the north of Kiruna. But not everything is what it seems.,"https://m.media-amazon.com/images/M/MV5BMzMyMTA2MzEtOTM5MC00YzRjLWE3NzEtMjMzNjgyMDM2MDMxXkEyXkFqcGdeQXVyMzY0MTE3NzU@._V1_QL75_UY281_CR4,0,190,281_.jpg"
410,rechill,Movie,"['Comedy', 'Drama']",A group of seven former college friends gather for a weekend reunion at a South Carolina vacation home after the funeral of another of their college friends.,"https://m.media-amazon.com/images/M/MV5BMTA4MjEyMTk5NzheQTJeQWpwZ15BbWU4MDY1NDA1MTAx._V1_QL75_UX190_CR0,4,190,281_.jpg"
411,rel romeyn en lamoree,Documentary,"['Documentary', 'Biography', 'Music']","Soda Stereo, Café Tacvba, Aterciopelados and others feature in this 50-year history of Latin American rock through dictatorships, disasters and dissent.","https://m.media-amazon.com/images/M/MV5BNTYxMTA5Y2YtNjBjYy00OWZiLTk4NzMtNzc5YjE3MGFiMTkxXkEyXkFqcGdeQXVyNjEwNTM2Mzc@._V1_QL75_UY281_CR18,0,190,281_.jpg"
412,retourtje,Documentary,['Documentary'],In this documentary we see three very different people's exceptional report of what they experienced in the no-man's land between life and death.,"https://m.media-amazon.com/images/M/MV5BMjdiYjUwOTEtMTc5Yy00NDVjLTkwNGEtMjI3MjczNzZlMTgyXkEyXkFqcGdeQXVyOTk0MDAwMA@@._V1_QL75_UY281_CR8,0,190,281_.jpg"
413,rintje,Series,"['Animation', 'Family']","In this pre-school animated series, puppy dog Rintje goes to school for the first time, has a birthday celebration, stays over at granny's and gets his first vaccination.","https://m.media-amazon.com/images/M/MV5BMTYwNjA5NjE0MV5BMl5BanBnXkFtZTgwMzg4NTU0OTE@._V1_QL75_UY281_CR116,0,190,281_.jpg"
414,riphagen,Movie,"['Biography', 'Drama', 'War']","The story about Riphagen, a cunning Dutch traitor during WW2 who helped Nazi round up Jews, stealing their treasures for himself. He destroyed Resistance groups, making many who pursued just... Read all","https://m.media-amazon.com/images/M/MV5BNDUxMGE1OGItZTk2OS00NGE4LTllZjItNDk1NGUwYzgwNDU0XkEyXkFqcGdeQXVyMjA5MDA0Mw@@._V1_QL75_UY281_CR4,0,190,281_.jpg"
415,rita krokodil,Series,['Animation'],"Rita is 4 years old, very determined and used to getting things her way. She has a very hungry friend, Crocodile, who lives in the bathtub. Most probably, Crocodile only exists in Rita's ima... Read all","https://m.media-amazon.com/images/M/MV5BMTUxOTYyMzI0N15BMl5BanBnXkFtZTgwNTE3NDgwNzE@._V1_QL75_UY281_CR0,0,190,281_.jpg"
416,robo sapiens,Documentary,['Documentary'],"State-of-the-art robots talk, dance, fight and play football with their designers, the world's leading cyber-scientists. So when are they going to take over?","https://m.media-amazon.com/images/M/MV5BNTE5ZGM4ZjUtNDk2Ny00NTZlLTk2ODktZWI2MmMxMDVlNWZiL2ltYWdlXkEyXkFqcGdeQXVyNzE5Mjk0NDg@._V1_QL75_UX140_CR0,0,140,140_.jpg"
417,roken,Movie,['Short'],"At his sunnet, his circumcision party, 7 year old Turkish boy Cihan, finds out that becoming a real man takes more of him, then just being circumcised.","https://m.media-amazon.com/images/M/MV5BMTY5OTc4OTk4Ml5BMl5BanBnXkFtZTgwOTUxMzQ5NDE@._V1_QL75_UY281_CR5,0,190,281_.jpg"
418,roos en haar mannen,Series,['Comedy'],A series full of sensational senseless action and extreme fun violence. Roos and her men are very busy setting up their own internet channel. Roos wants to become an online celebrity. She do... Read all,"https://m.media-amazon.com/images/M/MV5BNzkyYWZkYzEtNTAwZS00NTUwLWI4MDAtYmE5NTI0MTE3MDljXkEyXkFqcGdeQXVyMjQwMDg0Ng@@._V1_QL75_UY140_CR33,0,140,140_.jpg"
419,safe cave,Movie,"['Drama', 'Music', 'Romance']","A white midwestern girl moves to Chicago, where her new boyfriend is a black teen from the South Side with a rough, semi-criminal past.","https://m.media-amazon.com/images/M/MV5BNjViZGE1MWYtMjhlZC00MWNiLWE0M2EtOGVlYmUxNDZmY2QwXkEyXkFqcGdeQXVyMTQyMTMwOTk0._V1_QL75_UX190_CR0,2,190,281_.jpg"
420,sams kerst,Tv,['Family'],"Children's series about the seven-year-old Sam, who recently moved to a farm in a village in Groningen. The story takes places in the days before Christmas. Starring Anniek Pheifer, Tibor Lu... Read all","https://m.media-amazon.com/images/M/MV5BNTJiNmYzZGUtYjYzYS00OGFmLWJkYzctYmE5MzdkYzU5NzczXkEyXkFqcGdeQXVyMjMzNDYzMjA@._V1_QL75_UY281_CR155,0,190,281_.jpg"
421,sanditon,Series,"['Drama', 'Romance']","About Charlotte Heywood, a spirited and impulsive woman, who moves from her rural home to Sanditon, a fishing village attempting to reinvent itself as a seaside resort.","https://m.media-amazon.com/images/M/MV5BOTI2NWYzZTItMjlhYy00YWY4LWE0YTktZTFiNmUzZjFlNjY1XkEyXkFqcGdeQXVyNTE1NjY5Mg@@._V1_QL75_UY281_CR5,0,190,281_.jpg"
422,schatten uit de schaduw,Documentary,"['Documentary', 'Short']",Why do so many Dutch people struggle with their mental health? And why is this still a taboo? Hanna and Juda Verboom - like 1 in 4 Dutch people - have a mental variation. In 'Samen uit de sc... Read all,"https://m.media-amazon.com/images/M/MV5BYmRlM2E1N2UtYmVkYS00M2JmLTk1YWMtMTUxMThlNzZkZWRmXkEyXkFqcGdeQXVyNzk1MDEzNzE@._V1_QL75_UY281_CR5,0,190,281_.jpg"
423,school magic,Series,"['Animation', 'Adventure', 'Comedy']",An eccentric school-teacher takes her class on wondrous educational field trips with the help of a magical school bus.,"https://m.media-amazon.com/images/M/MV5BZDA1OWI3MzMtZTgzMC00ZGRiLWI2NjctNTYwZDViNjg4MWI1XkEyXkFqcGdeQXVyODk1MjAxNzQ@._V1_QL75_UX190_CR0,2,190,281_.jpg"
424,schuldig,Tv,['Thriller'],"The life of Eva Senn, professor, science journalist and successful non-fiction author, gets out of joint. First she loses her driver's license, then she only wants to reverse her friend Mari... Read all","https://m.media-amazon.com/images/M/MV5BY2IzZGZmN2QtMTlkZi00NGY1LTkxMjQtNWYxODUzM2FkZGM1XkEyXkFqcGdeQXVyNTM3MDMyMDQ@._V1_QL75_UY140_CR24,0,140,140_.jpg"
425,schuldig of niet,Tv,['Drama'],"How far are you allowed to go to defend yourself? In three dramatic reconstructions based on real events, we follow characters in very tricky situations who see no other option than to resor... Read all","https://m.media-amazon.com/images/M/MV5BMDQyOGU1YjctNjdlMS00Yzg0LTkwZDItYmFiZWZhNTBiOGEwXkEyXkFqcGdeQXVyMjA2OTY4OQ@@._V1_QL75_UY281_CR5,0,190,281_.jpg"
426,scrollodex,Tv,"['Biography', 'Drama', 'History']",Chronicles the financial meltdown of 2008 and centers on Treasury Secretary Henry Paulson.,"https://m.media-amazon.com/images/M/MV5BYzdkMDkxMDgtM2YzMi00YTM5LThkNWUtYmZkY2YwOTc4NmM3XkEyXkFqcGdeQXVyMTQ4NDY5OTc@._V1_QL75_UX190_CR0,0,190,281_.jpg"
427,see that justice is done,Movie,"['Drama', 'Mystery']",A trial of a mercy killing.,"https://m.media-amazon.com/images/M/MV5BM2QwMzkxMTEtMThiZS00YjY0LWEyYmItNjVhN2I3MDNmNjc3XkEyXkFqcGdeQXVyMDI3OTIzOA@@._V1_QL75_UY281_CR4,0,190,281_.jpg"
428,sesamstraat,Series,"['Animation', 'Adventure', 'Comedy']",Dutch version of Jim Henson's Sesame Street.,"https://m.media-amazon.com/images/M/MV5BMDViMWNlYjItNDMyZi00NWU2LWI0MTItNjNmNGU3MzYyYzY5XkEyXkFqcGdeQXVyNDUxNjc5NjY@._V1_QL75_UY281_CR4,0,190,281_.jpg"
429,shadowplay,Series,"['Drama', 'History', 'Thriller']",Max McLaughlin is an American cop who arrives in Berlin in the summer of 1946 to help create a police force in the chaotic aftermath of the war.,"https://m.media-amazon.com/images/M/MV5BM2M1YzFiYzAtNGUwYS00MmE1LTg2ZTEtM2FkYjg1NTgxMjgxXkEyXkFqcGdeQXVyNzg5MzIyOA@@._V1_QL75_UY281_CR18,0,190,281_.jpg"
430,shetland,Series,"['Crime', 'Drama', 'Mystery']",DI Jimmy Perez and his team investigate crimes within the close knit island community of Shetland.,"https://m.media-amazon.com/images/M/MV5BODU2OGYwNjUtMDQzOC00M2JjLWFhMWUtMmEyNWJkMmQzN2MyXkEyXkFqcGdeQXVyMDM2NDM2MQ@@._V1_QL75_UX190_CR0,0,190,281_.jpg"
